B;"Trigo, P; Coelho, H";;"Madureira, A; Ferreira, J; Vale, Z";;"Trigo, Paulo; Coelho, Helder";;;Collective-Intelligence and Decision-Making;COMPUTATIONAL INTELLIGENCE FOR ENGINEERING SYSTEMS: EMERGENT APPLICATIONS;Intelligent Systems Control and Automation Science and Engineering;;;;International Symposium on Computational Intelligence for Engineering Systems (ISCIES '09);NOV 19-20, 2009;Polytechn Porto, Sch Engn, Porto, PORTUGAL;;Polytechn Porto, Sch Engn;;;;;;;;Coelho, Helder/0000-0001-7622-8624;;;;;;;;;;;;;;978-94-007-0092-5;;;;2011;46;;;;;;61;76;;10.1007/978-94-007-0093-2_4;;;;;;;WOS:000395046300004;;;;;;
B;"Vale, Z; Venayagamoorthy, GK; Ferreira, J; Morais, H";;"Madureira, A; Ferreira, J; Vale, Z";;"Vale, Zita; Venayagamoorthy, Ganesh K.; Ferreira, Judite; Morais, Hugo";;;Computational Intelligence Applications for Future Power Systems;COMPUTATIONAL INTELLIGENCE FOR ENGINEERING SYSTEMS: EMERGENT APPLICATIONS;Intelligent Systems Control and Automation Science and Engineering;;;;International Symposium on Computational Intelligence for Engineering Systems (ISCIES '09);NOV 19-20, 2009;Polytechn Porto, Sch Engn, Porto, PORTUGAL;;Polytechn Porto, Sch Engn;;;;;;;Vale, Zita/N-1643-2019;Vale, Zita/0000-0002-4560-9544;;;;;;;;;;;;;;978-94-007-0092-5;;;;2011;46;;;;;;176;193;;10.1007/978-94-007-0093-2_12;;;;;;;WOS:000395046300012;;;;;;
B;"Fernandez-Ceniceros, J; Lostado-Lorza, R; Fernandez-Martinez, R; Sanz-Garcia, A; Martinez-de-Pison, FJ";;"Onate, E; Owen, DRJ; Peric, D; Suarez, B";;"Fernandez-Ceniceros, Julio; Lostado-Lorza, Ruben; Fernandez-Martinez, Roberto; Sanz-Garcia, Andres; Javier Martinez-de-Pison, Fco";;;PREDICTIVE MODELS FOR BOLTED T. STUB CONNECTIONS COMBINING FEM WITH INTELLIGENT ARTIFICIAL TECHNIQUES;COMPUTATIONAL PLASTICITY XI: FUNDAMENTALS AND APPLICATIONS;;;;;11th International Conference on Computational Plasticity (COMPLAS) - Fundamentals and Applications;SEP 07-09, 2011;Barcelona, SPAIN;;;;;;;;;"Martinez, Roberto Fernandez/K-5770-2014; Sanz-Garcia, Andres/F-7981-2012; Martinez-de-Pison, F. J. FJMPA/H-1502-2012";"Martinez, Roberto Fernandez/0000-0002-9436-6577; Sanz-Garcia, Andres/0000-0003-0413-4965; Martinez-de-Pison, F. J. FJMPA/0000-0002-3063-7374";;;;;;;;;;;;;;978-84-89925-73-1;;;;2011;;;;;;;1478;1489;;;;;;;;;WOS:000313557900135;;;;;;
B;"Santiago, CB; Sousa, A; Reis, LP; Estriga, ML";;"Tavares, JMRS; Jorge, RMN";;"Santiago, Catarina B.; Sousa, Armando; Reis, Luis Paulo; Estriga, Maria Luisa";;;Real Time Colour Based Player Tracking in Indoor Sports;COMPUTATIONAL VISION AND MEDICAL IMAGE PROCESSING: RECENT TRENDS;Computational Methods in Applied Sciences;;;;2nd ECCOMAS Thematic Conference on Computational Vision and Medical Image Processing (VIPimage 2009);OCT 14-16, 2009;Univ Porto, Engn Fac, Porto, PORTUGAL;European Community Computat Methods Appl Sci, Portuguese Assoc Theoret Appl Computat Mech, Univ Porto;Univ Porto, Engn Fac;;;;;;;"Sousa, Armando Jorge/AAC-3579-2020; Reis, Luis Paulo/M-3202-2013";"Sousa, Armando Jorge/0000-0002-0317-4714; Reis, Luis Paulo/0000-0002-4709-1718";;;;;;;;;;;;;;978-94-007-0010-9;;;;2011;19;;;;;;17;35;;10.1007/978-94-007-0011-6_2;;;;;;;WOS:000395366400002;;;;;;
S;"Alipoor, A; Fesharaki, M";;Ting, Z;;"Alipoor, Abdolhossein; Fesharaki, Mehdi";;;Optimal Sensor Deployment for Object Recognition using Artificial Intelligence Methods;COMPUTER COMMUNICATION AND MANAGEMENT;International Proceedings of Computer Science and Information Technology;;;;International Conference on Computer Communication and Management (ICCCM 2011);MAY 02-03, 2011;Sydney, AUSTRALIA;Int Assoc Comp Sci & Informat Technol, Singapore Inst Elect;;;;;;;;;;;;;;;;;;;;;2010-460X;;978-981-08-8636-3;;;;2011;5;;;;;;247;251;;;;;;;;;WOS:000400799700044;;;;;;
S;"Jaryani, F; Sahibudin, S; Ibrahim, S; Daruis, R; Nasab, SS; Jamshidi, J";;Ting, Z;;"Jaryani, Farhang; Sahibudin, Shamsul; Ibrahim, Suhaimi; Daruis, Rusni; Nasab, Samaneh Salehi; Jamshidi, Jamshid";;;INTELLIGENT REFLECTIVE E-PORTFOLIO FARMEWORK BASED ON ARTIFICIAL INTELLIGENT SCHEDULING TECHNIQUES;COMPUTER COMMUNICATION AND MANAGEMENT;International Proceedings of Computer Science and Information Technology;;;;International Conference on Computer Communication and Management (ICCCM 2011);MAY 02-03, 2011;Sydney, AUSTRALIA;Int Assoc Comp Sci & Informat Technol, Singapore Inst Elect;;;;;;;;"Sahibuddin, Shamsul/K-7938-2012; Jaryani, Farhang/AAR-5512-2020";Jaryani, Farhang/0000-0001-8374-6681;;;;;;;;;;;;2010-460X;;978-981-08-8636-3;;;;2011;5;;;;;;562;564;;;;;;;;;WOS:000400799700103;;;;;;
S;"Warwick, K; Nasuto, SJ; Becerra, VM; Whalley, BJ";;Cai, Y;;"Warwick, Kevin; Nasuto, Slawomir J.; Becerra, Victor M.; Whalley, Benjamin J.";;;Experiments with an In-Vitro Robot Brain;COMPUTING WITH INSTINCT: REDISCOVERING ARTIFICIAL INTELLIGENCE;Lecture Notes in Artificial Intelligence;;;;1st Instinctive Computing Workshop;JUN 09-10, 2009;Carnegie Mellon Univ, Pittsburgh, PA;Natl Sci Fdn, Carnegie Mellon Univ, Cylab, Google;Carnegie Mellon Univ;;;;;;;Becerra, Victor/AAA-1361-2020;"Becerra, Victor/0000-0002-3790-4236; Warwick, Kevin/0000-0003-3722-9960; Nasuto, Slawomir/0000-0001-9414-9049";;;;;;;;;;;;0302-9743;1611-3349;"978-3-642-19756-7; 978-3-642-19757-4";;;;2011;5897;;;;;;1;15;;;;;;;;;WOS:000312439100001;;;;;;
B;"Liu, J; Zhao, S; Zhao, Q";;;CCEOC;"Liu, Jing; Zhao, Shan; Zhao, Qian";;;Research and Innovation on the Course of Data Image Processing;CONFERENCE ON CREATIVE EDUCATION (CCE2011);;;;;Conference on Creative Education (CCE 2011);APR 08-10, 2011;Wuhan, PEOPLES R CHINA;Wuhan Univ, Huazhong Normal Univ, James Madison Univ, Sci Res Publish, Engn Informat Inst, Chongqing VIP Informat Co, Ltd;;;;;;;;;;;;;;;;;;;;;;;978-1-935068-26-6;;;;2011;;;;;;;186;+;;;;;;;;;WOS:000297713000046;;;;;;
S;"Shourangiz, E; Mohamad, MI; Hassanabadi, MS; Banihashemi, SS; Bakhtiari, M; Torabi, M";;Zhang, M;;"Shourangiz, Ehsan; Mohamad, Ibrahim Mohamad; Hassanabadi, Mahmoud Shakouri; Banihashemi, Seyed Saeed; Bakhtiari, Mohsen; Torabi, Mohsen";;;Flexibility of BIM towards Design Change;CONSTRUCTION AND PROJECT MANAGEMENT, ICCPM 2011;International Proceedings of Economics Development and Research;;;;2nd International Conference on Construction and Project Management (ICCPM 2011);SEP 16-18, 2011;Singapore, SINGAPORE;;;;;;;;;Banihashemi, Saeed/W-2808-2018;Banihashemi, Saeed/0000-0002-7438-1235;;;;;;;;;;;;2010-4626;;978-981-08-9176-3;;;;2011;15;;;;;;79;83;;;;;;;;;WOS:000392456000016;;;;;;
B;"Ilie, C; Ilie, M; Topalu, AM; Melnic, L";;Soliman, KS;;"Ilie, Constantin; Ilie, Margareta; Topalu, Ana-Maria; Melnic, Lucia";;;The Use of Artificial Intelligence for the Simulation of the US Consumer Credit Fluctuation;CREATING GLOBAL COMPETITIVE ECONOMIES: A 360-DEGREE APPROACH, VOLS 1-4;;;;;17th International-Business-Information-Management-Association Conference;NOV 14-15, 2011;Milan, ITALY;Int Business Informat Management Assoc;;;;;;;;"Ilie, Constantin D./D-1590-2015; Lucia, Melnic/H-9642-2019";"Ilie, Constantin D./0000-0002-1086-2371; Ilie, Margareta/0000-0001-9048-4747";;;;;;;;;;;;;;978-0-9821489-6-9;;;;2011;;;;;;;2415;2431;;;;;;;;;WOS:000317550001132;;;;;;
S;"Chow, YW; Susilo, W";;"Lin, DD; Tsudik, G; Wang, XY";;"Chow, Yang-Wai; Susilo, Willy";;;AniCAP: An Animated 3D CAPTCHA Scheme Based on Motion Parallax;CRYPTOLOGY AND NETWORK SECURITY;Lecture Notes in Computer Science;;;;10th International Conference on Cryptography and Network Security (CANS 2011);DEC 10-12, 2011;Sanya, PEOPLES R CHINA;Natl Nat Sci Fdn China, Shandong Univ;;;;;;;;Susilo, Willy/A-3724-2008;Chow, Yang-Wai/0000-0003-3348-7014;;;;;;;;;;;;0302-9743;1611-3349;"978-3-642-25512-0; 978-3-642-25513-7";;;;2011;7092;;;;;;255;+;;;;;;;;;WOS:000307747400018;;;;;;
B;"Stevovic, S; Stamatovic, M; Ivanovic, G";;"Schleiss, AJ; Boes, RM";;"Stevovic, S.; Stamatovic, M.; Ivanovic, G.";;;Methodological approach and artificial intelligence application as a solution for environmental conflict related to large dams;DAMS AND RESERVOIRS UNDER CHANGING CHALLENGES;;;;;International Symposium on Dams and Reservoirs Under Changing Challenges During the 79th Annual Meeting of the International-Commission-on-Large-Dams (ICOLD);JUN 01, 2011;Lucerne, SWITZERLAND;Int Commiss Large Dams, KWO, STUCKY, Marti Holding AG Bauunternehmungen, BKW FMB Energie AG, Swiss Confederat, Swiss Fed Off Energy, POYRY, Huggenberger AG, EWZ Energie, ALPIQ, REPOWER, Ofima Maggia Kraftwerke AG, Grande Dixence, Holcim, KWZ Kraftwerke Zervreila AG, FMV, EnAlpin, SIG, SFMCP, Kraftwerke KHR Hinterrhein AG, EKWOEE, ACE, IM;;;;;;;;;Stevovic, Svetlana/0000-0001-8913-802X;;;;;;;;;;;;;;"978-0-203-80409-4; 978-0-415-68267-1";;;;2011;;;;;;;785;790;;;;;;;;;WOS:000340662500094;;;;;;
S;"Goumeidane, AB; Khamadja, M; Nacereddine, N";;"Cherifi, H; Zain, JM; ElQawasmeh, E";;"Goumeidane, Aicha Baya; Khamadja, Mohammed; Nacereddine, Nafaa";;;Adaptive and Statistical Polygonal Curve for Multiple Weld Defects Detection in Radiographic Images;DIGITAL INFORMATION AND COMMUNICATION TECHNOLOGY AND ITS APPLICATIONS, PT I;Communications in Computer and Information Science;;;;International Conference on Digital Information and Communication Technology and Its Applications;JUN 21-23, 2011;Univ Bourgogne, Dijon, FRANCE;Springer;Univ Bourgogne;;;;;;;"Goumeidane, Aicha Baya/A-1109-2011; Nacereddine, Nafaa/D-4425-2014";Nacereddine, Nafaa/0000-0003-1351-2200;;;;;;;;;;;;1865-0929;1865-0937;978-3-642-21983-2;;;;2011;166;;1;;;;184;+;;;;;;;;;WOS:000307036100016;;;;;;
S;"Mini, S; Udgata, SK; Sabat, SL";;"Natarajan, R; Ojo, A";;"Mini, S.; Udgata, Siba K.; Sabat, Samrat L.";;;Artificial Bee Colony Based Sensor Deployment Algorithm for Target Coverage Problem in 3-D Terrain;DISTRIBUTED COMPUTING AND INTERNET TECHNOLOGY;Lecture Notes in Computer Science;;;;5th International Conference on Distributed Computing and Internet Technologies (ICDCIT);DEC 10-12, 2008;New Delhi, INDIA;KIIT Univ;;;;;;;;Udgata, Siba K./U-2992-2019;"Sabat, Samrat/0000-0002-1197-2943; Udgata, Siba/0000-0001-8314-2618";;;;;;;;;;;;0302-9743;1611-3349;978-3-642-19055-1;;;;2011;6536;;;;;;313;+;;;;;;;;;WOS:000296894400024;;;;;;
S;"Brazdil, P; Teixeira, F";;"Peixoto, MM; Pinto, AA; Rand, DA";;"Brazdil, Pavel; Teixeira, Frederico";;;Microeconomic Model Based on MAS Framework: Modeling an Adaptive Producer;DYNAMICS, GAMES AND SCIENCE I;Springer Proceedings in Mathematics;;;;International Conference on Dynamical Systems and Game Theory in Honor of Mauricio Peixoto and David Rand;SEP 08-12, 2008;Univ Minho, Braga, PORTUGAL;;Univ Minho;;;;;;;;Brazdil, Pavel/0000-0002-4720-0486;;;;;;;;;;;;2190-5614;;"978-3-642-11456-4; 978-3-642-11455-7";;;;2011;1;;;;;;139;157;;10.1007/978-3-642-11456-4_9;;;;;;;WOS:000393993000009;;;;;;
S;Blobel, B;;"StoicuTivader, L; Blobel, B; Marcun, T; Orel, A";;Blobel, Bernd;;;Ontologies, Knowledge Representation, Artificial Intelligence - Hype or Prerequisites for International pHealth Interoperability?;E-HEALTH ACROSS BORDERS WITHOUT BOUNDARIES: E-SALUS TRANS CONFINIA SINE FINIBUS;Studies in Health Technology and Informatics;;;;11th European-Federation-of-Medical-Informatics (EFMI) Special Topic Conference (STC);APR 14-15, 2011;Lasko, SLOVENIA;European Federat Med Informat, Slovenian Med Informat Soc;;;;;;;;;;;;;;;;;;;;;0926-9630;;978-1-60750-735-2;;;;2011;165;;;;;;11;20;;10.3233/978-1-60750-735-2-11;;;;;;;WOS:000392233300002;21685580;;;;;
S;Krejcar, O;;"Yonazi, JJ; Sedoyeka, E; Ariwa, E; ElQawasmeh, E";;Krejcar, Ondrej;;;Utilization of C# Neural Networks Library in Industry Applications;E-TECHNOLOGIES AND NETWORKS FOR DEVELOPMENT;Communications in Computer and Information Science;;;;1st International Conference on e-Technologies and Networks for Development (ICeND 2011);AUG 03-05, 2011;Inst Finance Management, Dar es Salaam, TANZANIA;Springer, Inst Finance Management, Soc Digital Informat & Wireless Commun;Inst Finance Management;;;;;;;Krejcar, Ondrej/A-8639-2008;Krejcar, Ondrej/0000-0002-5992-2574;;;;;;;;;;;;1865-0929;1865-0937;978-3-642-22728-8;;;;2011;171;;;;;;61;72;;;;;;;;;WOS:000296263100006;;;;;;
B;"Coskun, E; Cagdas, G";;"Zupancic, T; Juvancic, M; Verovsek, S; Jutraz, A";;"Coskun, Emirhan; Cagdas, Gulen";;;An Integrated Model For Emergent City Behavior Based On User Movements;ECAADE 2011: RESPECTING FRAGILE PLACES;;;;;29th Conference on Education in Computer Aided Architectural Design in Europe (eCAADe);SEP 21-24, 2011;Univ Ljubljana, Fac Architecture, Ljubljana, SLOVENIA;Slovenian Res Agcy, Autodesk, Bentley, Butan Plin, IB PROCADD, Pekarna Hlebcek;Univ Ljubljana, Fac Architecture;;;;;;;Cagdas, Gulen/M-4230-2015;Cagdas, Gulen/0000-0001-8853-4207;;;;;;;;;;;;;;978-9-4912070-1-3;;;;2011;;;;;;;159;165;;;;;;;;;WOS:000335665500018;;;;;;
B;"Langenhan, C; Hass, S; Weber, M; Petzold, F; Liwicki, M; Dengel, A";;"Zupancic, T; Juvancic, M; Verovsek, S; Jutraz, A";;"Langenhan, Christoph; Hass, Sebastian; Weber, Markus; Petzold, Frank; Liwicki, Marcus; Dengel, Andreas";;;Investigating research strategies for accessing knowledge stored in semantic models;ECAADE 2011: RESPECTING FRAGILE PLACES;;;;;29th Conference on Education in Computer Aided Architectural Design in Europe (eCAADe);SEP 21-24, 2011;Univ Ljubljana, Fac Architecture, Ljubljana, SLOVENIA;Slovenian Res Agcy, Autodesk, Bentley, Butan Plin, IB PROCADD, Pekarna Hlebcek;Univ Ljubljana, Fac Architecture;;;;;;;;;;;;;;;;;;;;;;978-9-4912070-1-3;;;;2011;;;;;;;403;411;;;;;;;;;WOS:000335665500046;;;;;;
B;"Cui, J; Tang, MX";;"Rosa, A; Kacprzyk, J; Filipe, J; Correia, AD";;"Cui, Jia; Tang, Ming Xi";;;GENERATIVE DESIGN EXPLORATION FRAMEWORK BASED ON SUBJECTIVE EVALUATION;ECTA 2011/FCTA 2011: PROCEEDINGS OF THE INTERNATIONAL CONFERENCE ON EVOLUTIONARY COMPUTATION THEORY AND APPLICATIONS AND INTERNATIONAL CONFERENCE ON FUZZY COMPUTATION THEORY AND APPLICATIONS;;;;;International Conference on Evolutionary Computation Theory and Applications (ECTA 2011) / International Conference on Fuzzy Computation Theory and Applications (FCTA 2011);OCT 24-26, 2011;Univ Paris Est Creteil, Paris, FRANCE;Inst Syst & Technol Informat Control & Commun;Univ Paris Est Creteil;;;;;;;;;;;;;;;;;;;;;;978-989-8425-83-6;;;;2011;;;;;;;303;306;;;;;;;;;WOS:000392458400048;;;;;;
B;Zhao, QF;;"Rosa, A; Kacprzyk, J; Filipe, J; Correia, AD";;Zhao, Qiangfu;;;AWARENESS COMPUTING: WHAT, WHY, AND HOW?;ECTA 2011/FCTA 2011: PROCEEDINGS OF THE INTERNATIONAL CONFERENCE ON EVOLUTIONARY COMPUTATION THEORY AND APPLICATIONS AND INTERNATIONAL CONFERENCE ON FUZZY COMPUTATION THEORY AND APPLICATIONS;;;;;International Conference on Evolutionary Computation Theory and Applications (ECTA 2011) / International Conference on Fuzzy Computation Theory and Applications (FCTA 2011);OCT 24-26, 2011;Univ Paris Est Creteil, Paris, FRANCE;Inst Syst & Technol Informat Control & Commun;Univ Paris Est Creteil;;;;;;;;;;;;;;;;;;;;;;978-989-8425-83-6;;;;2011;;;;;;;;;;;;;;;;;WOS:000392458400001;;;;;;
S;"Gharehchopogh, FS; Khalifelu, ZA";;Dan, C;;"Gharehchopogh, Farhad Soleimanian; Khalifelu, Zeynab Abbasi";;;Using Intelligent Tutoring Systems in Instruction and Education;EDUCATION AND MANAGEMENT TECHNOLOGY, ICEMT 2011;International Proceedings of Economics Development and Research;;;;2nd International Conference on Education and Management Technology (ICEMT 2011);AUG 19-21, 2011;Shanghai, PEOPLES R CHINA;;;;;;;;;Gharehchopogh, Farhad Soleimanian/AAX-9598-2020;;;;;;;;;;;;;2010-4626;;978-981-08-9174-9;;;;2011;13;;;;;;250;254;;;;;;;;;WOS:000392455900048;;;;;;
J;Cases, JCP;;;;Piquer Cases, Juan Carlos;;;AUTOMATED FORMS IN THE ARCHITECTURE. CRITICAL REFLECTIONS;EGA-REVISTA DE EXPRESION GRAFICA ARQUITECTONICA;;;;;;;;;;;;;;;;;;;;;;;;;;;;;1133-6137;;;;;;2011;;18;;;;;214;223;;;;;;;;;WOS:000296131400023;;;;;;
S;"Maskeliunas, R; Simutis, R; Raudonis, V";;"Navickas, A; Sauhats, A; Virbalis, A; Azubalis, M; Galvanauskas, V; Jonaitis, A; Brazauskas, K";;"Maskeliunas, Rytis; Simutis, Rimvydas; Raudonis, Vidas";;;DEVELOPMENT AND MODELING OF AN INTELLIGENT MULTIMODAL INTERFACE FOR SMART MOBILITY DEVICES;ELECTRICAL AND CONTROL TECHNOLOGIES;Electrical and Control Technologies;;;;6th International Conference on Electrical and Control Technologies (ECT 2011);MAY 05-06, 2011;Kaunas Univ Technol, Kaunas, LITHUANIA;Res Council Lithuania, ABB UAB;Kaunas Univ Technol;;;;;;;Maskeliunas, Rytis/J-7173-2017;Maskeliunas, Rytis/0000-0002-2809-2213;;;;;;;;;;;;1822-5934;;;;;;2011;;;;;;;11;14;;;;;;;;;WOS:000306934200001;;;;;;
S;Nordin, P;;"KofodPetersen, A; Heintz, F; Langseth, H";;Nordin, Peter;;;Perspectives on artificial intelligence in a business environment;ELEVENTH SCANDINAVIAN CONFERENCE ON ARTIFICIAL INTELLIGENCE (SCAI 2011);Frontiers in Artificial Intelligence and Applications;;;;11th Scandinavian Conference on Artificial Intelligence (SCAI);MAY 24-26, 2011;Trondheim, NORWAY;Norwegian Univ Sci & Technol, Norwegian Artificial Intelligence Soc, Verdande Technologies, Norwegian Res Council;;;;;;;;;;;;;;;;;;;;;0922-6389;;"978-1-60750-754-3; 978-1-60750-753-6";;;;2011;227;;;;;;5;5;;10.3233/978-1-60750-754-3-5;;;;;;;WOS:000329410700003;;;;;;
S;"Rocki, K; Suda, R";;"KofodPetersen, A; Heintz, F; Langseth, H";;"Rocki, Kamil; Suda, Reiji";;;Parallel Monte Carlo Tree Search on GPU;ELEVENTH SCANDINAVIAN CONFERENCE ON ARTIFICIAL INTELLIGENCE (SCAI 2011);Frontiers in Artificial Intelligence and Applications;;;;11th Scandinavian Conference on Artificial Intelligence (SCAI);MAY 24-26, 2011;Trondheim, NORWAY;Norwegian Univ Sci & Technol, Norwegian Artificial Intelligence Soc, Verdande Technologies, Norwegian Res Council;;;;;;;;;;;;;;;;;;;;;0922-6389;;"978-1-60750-754-3; 978-1-60750-753-6";;;;2011;227;;;;;;80;89;;10.3233/978-1-60750-754-3-80;;;;;;;WOS:000329410700013;;;;;;
S;"Shi, L; Liu, Y; Ma, XM";;"Deng, H; Miao, D; Wang, FL; Lei, JS";;"Shi, Lei; Liu, Yi; Ma, Xinming";;;Credit Assessment with Random Forests;EMERGING RESEARCH IN ARTIFICIAL INTELLIGENCE AND COMPUTATIONAL INTELLIGENCE;Communications in Computer and Information Science;;;;3rd International Conference on Artificial Intelligence and Computational Intelligence (AICI 2011);SEP 23-25, 2011;Taiyuan, PEOPLES R CHINA;Taiyuan Univ Technol;;;;;;;;;;;;;;;;;;;;;1865-0929;1865-0937;"978-3-642-24281-6; 978-3-642-24282-3";;;;2011;237;;;;;;24;28;;;;;;;;;WOS:000310936100004;;;;;;
B;Tlustos, J;;Fuis, V;;Tlustos, J.;;;HYDRAULIC SYSTEMS FOR THE FUTURE;ENGINEERING MECHANICS 2011;;;;;17th International Conference on Engineering Mechanics;MAY 09-12, 2011;Svratka, CZECH REPUBLIC;;;;;;;;;;;;;;;;;;;;;;;;978-80-87012-33-8;;;;2011;;;;;;;623;626;;;;;;;;;WOS:000313492700149;;;;;;
B;"Veseliny, M; Zidek, K; Liska, O";;Fuis, V;;"Veseliny, M.; Zidek, K.; Liska, O.";;;APPLICATION OF ADVANCED TECHNOLOGIES IN REHABILITATION PROCESS;ENGINEERING MECHANICS 2011;;;;;17th International Conference on Engineering Mechanics;MAY 09-12, 2011;Svratka, CZECH REPUBLIC;;;;;;;;;"Zidek, Kamil/D-8133-2015; Zidek, Kamil/K-2739-2019";"Zidek, Kamil/0000-0003-0176-7433; Zidek, Kamil/0000-0003-0176-7433";;;;;;;;;;;;;;978-80-87012-33-8;;;;2011;;;;;;;651;654;;;;;;;;;WOS:000313492700156;;;;;;
S;"Strenzke, R; Schulte, A";;Harris, D;;"Strenzke, Ruben; Schulte, Axel";;;Mixed-Initiative Multi-UAV Mission Planning by Merging Human and Machine Cognitive Skills;ENGINEERING PSYCHOLOGY AND COGNITIVE ERGONOMICS;Lecture Notes in Artificial Intelligence;;;;9th International Conference on Engineering Psychology and Cognitive Ergonomics (EPCE) Held as Part of 14th International Conference on Human-Computer Interaction (HCI);JUL 09-14, 2011;Orlando, FL;;;;;;;;;;;;;;;;;;;;;;0302-9743;;978-3-642-21740-1;;;;2011;6781;;;;;;608;617;;;;;;;;;WOS:000312502700065;;;;;;
S;"Costa, N; Carneiro, D; Novais, P; Barbieri, D; Andrade, F";;"Filipe, J; Cordeiro, J";;"Costa, Nuno; Carneiro, Davide; Novais, Paulo; Barbieri, Diovana; Andrade, Francisco";;;An Advice System for Consumer's Law Disputes;ENTERPRISE INFORMATION SYSTEMS;Lecture Notes in Business Information Processing;;;;12th International Conference on Enterprise Information Systems;JUN 08-AUG 12, 2010;Funchal, PORTUGAL;Inst Syst & Technol Informat, Control & Commun;;;;;;;;"Carneiro, Davide/A-3490-2014; Novais, Paulo/M-4053-2013";"Carneiro, Davide/0000-0002-6650-0388; Novais, Paulo/0000-0002-3549-0754; Andrade, Francisco/0000-0001-5764-7815";;;;;;;;;;;;1865-1348;;978-3-642-19801-4;;;;2011;73;;;;;;237;+;;;;;;;;;WOS:000291631100017;;;;;;
B;"Jing, HT; Zhang, YS; Shi, XX; Sun, RG";;Luo, J;;"Jing Haitao; Zhang Yangsong; Shi Xingxi; Sun Rongguan";;;The Research Of The Expert System For Tunnel Construction Method Based On The Network;EPLWW3S 2011: 2011 INTERNATIONAL CONFERENCE ON ECOLOGICAL PROTECTION OF LAKES-WETLANDS-WATERSHED AND APPLICATION OF 3S TECHNOLOGY, VOL 2;;;;;International Conference on Ecological Protection of Lakes-Wetlands-Watershed and Application of 3S Technology (EPLWW3S 2011);JUN 25-26, 2011;Nanchang, PEOPLES R CHINA;Jiangxi Assoc Sci & Technol, Jiangxi Normal Univ, Elite Intellectual Resources Overseas, Lead Grp Off, Jiangxi Normal Univ, Minist Educ, Key Lab Poyang Lake Wetland & Watershed Res, Jiangxi Promot Assoc Int Exchange Sci & Technol;;;;;;;;;;;;;;;;;;;;;;;978-988-19116-8-1;;;;2011;;;;;;;188;192;;;;;;;;;WOS:000391516000044;;;;;;
B;"Yu, H; Yi, H";;Luo, J;;"Yu, Huang; Yi, He";;;Based on GIS inland waterway land-levying relocation aided design system;EPLWW3S 2011: 2011 INTERNATIONAL CONFERENCE ON ECOLOGICAL PROTECTION OF LAKES-WETLANDS-WATERSHED AND APPLICATION OF 3S TECHNOLOGY, VOL 3;;;;;International Conference on Ecological Protection of Lakes-Wetlands-Watershed and Application of 3S Technology (EPLWW3S 2011);JUN 25-26, 2011;Nanchang, PEOPLES R CHINA;Jiangxi Assoc Sci & Technol, Jiangxi Normal Univ, Elite Intellectual Resources Overseas, Lead Grp Off, Jiangxi Normal Univ, Minist Educ, Key Lab Poyang Lake Wetland & Watershed Res, Jiangxi Promot Assoc Int Exchange Sci & Technol;;;;;;;;;;;;;;;;;;;;;;;978-988-19116-8-1;;;;2011;;;;;;;365;367;;;;;;;;;WOS:000391516100086;;;;;;
S;"Ke, HC; Wang, H; Kong, DG";;Chen, X;;"Ke, Hongchang; Wang, Hui; Kong, Degang";;;Coding Method of Visual Perception Reconstruction Based on Curve Fitting and Energy Function;EQUIPMENT MANUFACTURING TECHNOLOGY AND AUTOMATION, PTS 1-3;Advanced Materials Research;;;;International Conference on Advanced Design and Manufacturing Engineering (ADME 2011);SEP 16-18, 2011;Guangzhou, PEOPLES R CHINA;Guangdong Univ Technol, Huazhong Univ Sci & Technol, Hong Kong Univ Sci & Technol, Hong Kong Polytechn Univ, Univ Nottingham;;;;;;;;;;;;;;;;;;;;;1022-6680;;978-3-03785-216-3;;;;2011;317-319;;;;;;942;+;;10.4028/www.scientific.net/AMR.317-319.942;;;;;;;WOS:000308571200182;;;;;;
B;Chen, CH;;"Lin, DYM; Chen, HC";;Chen, Chiung-Hui;;;Research on the script language as a fundamental coordination mechanism for agents of spatial objects;ERGONOMICS FOR ALL: CELEBRATING PPCOE'S 20 YEARS OF EXCELLENCE;;;;;9th Pan-Pacific Conference on Ergonomics (PPCOE 2010);NOV 07-10, 2010;Ergonom Soc Taiwan, Kaohsiung, TAIWAN;;Ergonom Soc Taiwan;;;;;;;;;;;;;;;;;;;;;;978-0-203-82933-2;;;;2011;;;;;;;577;581;;;;;;;;;WOS:000306716400098;;;;;;
S;"Calinescu, R; Kikuchi, S";;"Calinescu, R; Jackson, E";;"Calinescu, Radu; Kikuchi, Shinji";;;Formal Methods @ Runtime;FOUNDATIONS OF COMPUTER SOFTWARE: MODELING, DEVELOPMENT, AND VERIFICATION OF ADAPTIVE SYSTEMS;Lecture Notes in Computer Science;;;;16th Monterey Workshop;MAR 31-APR 02, 2010;Microsoft Res Redmond, Redmond, WA;NSF, ONR, AFOSR, ARO, DARPA, Microsoft;Microsoft Res Redmond;;;;;;;Calinescu, Radu/AAN-1912-2020;;;;;;;;;;;;;0302-9743;;978-3-642-21292-5;;;;2011;6662;;;;;;122;135;;;;;;;;;WOS:000392099900007;;;;;;
S;"Mingo, JM; Aler, R";;"Ferrandez, JM; Sanchez, JRA; DeLaPaz, F; Toledo, FJ";;"Mario Mingo, Jack; Aler, Ricardo";;;An Incremental Model of Lexicon Consensus in a Population of Agents by Means of Grammatical Evolution, Reinforcement Learning and Semantic Rules;FOUNDATIONS ON NATURAL AND ARTIFICIAL COMPUTATION: 4TH INTERNATIONAL WORK-CONFERENCE ON THE INTERPLAY BETWEEN NATURAL AND ARTIFICIAL COMPUTATION, IWINAC 2011, PART I;Lecture Notes in Computer Science;;;;4th International Work-Conference on the Interplay Between Natural and Artificial Computation (IWINAC);MAY 30-JUN 03, 2011;La Palma, SPAIN;UNED, Univ Politecnica Cartagena, Spanish Minist Ciencia & Innovac, CYTED, Red Nacl Computac Nat & Artificial, APLIQUEM S L;;;;;;;;Mingo, Jack Mario/B-5875-2014;"Mingo, Jack Mario/0000-0003-2457-3375; Aler, Ricardo/0000-0002-7472-4840";;;;;;;;;;;;0302-9743;1611-3349;978-3-642-21344-1;;;;2011;6686;;;;;;40;49;;;;;;;;;WOS:000308635500005;;;;;;
S;"Trueba, P; Prieto, A; Caamano, P; Bellas, F; Duro, RJ";;"Ferrandez, JM; Sanchez, JRA; DeLaPaz, F; Toledo, FJ";;"Trueba, P.; Prieto, A.; Caamano, P.; Bellas, F.; Duro, R. J.";;;Task-Driven Species in Evolutionary Robotic Teams;FOUNDATIONS ON NATURAL AND ARTIFICIAL COMPUTATION: 4TH INTERNATIONAL WORK-CONFERENCE ON THE INTERPLAY BETWEEN NATURAL AND ARTIFICIAL COMPUTATION, IWINAC 2011, PART I;Lecture Notes in Computer Science;;;;4th International Work-Conference on the Interplay Between Natural and Artificial Computation (IWINAC);MAY 30-JUN 03, 2011;La Palma, SPAIN;UNED, Univ Politecnica Cartagena, Spanish Minist Ciencia & Innovac, CYTED, Red Nacl Computac Nat & Artificial, APLIQUEM S L;;;;;;;;"Bellas, Francisco/M-5008-2018; Fernandez, Richard Jose Duro/R-5084-2019";"Bellas, Francisco/0000-0001-6043-1468; Duro, Richard J./0000-0002-6807-524X";;;;;;;;;;;;0302-9743;1611-3349;978-3-642-21344-1;;;;2011;6686;;;;;;138;147;;;;;;;;;WOS:000308635500015;;;;;;
