S;"Hsieh, MY; Kung, CY; Lai, CS; Chen, CT";;Zeng, D;;"Hsieh Ming-Yuan; Kung, Chaang-Yung; Lai, Chih-Sung; Chen, Chi-Tung";;;Utilizing the QFD to Make the Most Potential Marketing Strategy through Applying the Innovative Wireless Technology in A Hypercompetitive Era;MATERIALS, MECHATRONICS AND AUTOMATION, PTS 1-3;Key Engineering Materials;;;;International Conference on Materials, Mechatronics and Automation (ICMMA 2011);JAN 15-16, 2011;Melbourne, AUSTRALIA;Natl Univ Singapore, Int Sci & Engn Ctr;;;;;;;;;Hsieh, Ming-Yuan/0000-0002-8503-057X;;;;;;;;;;;;1013-9826;;;;;;2011;467-469;;;;;;1000;+;;10.4028/www.scientific.net/KEM.467-469.1000;;;;;;;WOS:000303364700185;;;;;;
S;"Yang, GW; Liu, W";;Zeng, D;;"Yang Guowei; Liu Wei";;;Some Motion Models of Artificial Animals and Momentarily Continously Switching of the Models;MATERIALS, MECHATRONICS AND AUTOMATION, PTS 1-3;Key Engineering Materials;;;;International Conference on Materials, Mechatronics and Automation (ICMMA 2011);JAN 15-16, 2011;Melbourne, AUSTRALIA;Natl Univ Singapore, Int Sci & Engn Ctr;;;;;;;;;;;;;;;;;;;;;1013-9826;;;;;;2011;467-469;;;;;;1012;+;;10.4028/www.scientific.net/KEM.467-469.1012;;;;;;;WOS:000303364700187;;;;;;
S;"Fu, YL; Chen, SQ; Zhang, LH";;"Zhang, LC; Zhang, CL; Chen, Z";;"Fu, Yanglie; Chen, Shuqian; Zhang, Lihong";;;Ant Colony Algorithm's Application of Textile Monitoring Image Recognition;MECHATRONICS AND MATERIALS PROCESSING I, PTS 1-3;Advanced Materials Research;;;;International Conference on Mechatronics and Materials Processing (ICMMP 2011);NOV 18-20, 2011;Guangzhou, PEOPLES R CHINA;Guangzhou Univ, Univ New S Wales, Zhejiang Univ, Xian Jiaotong Univ;;;;;;;;;;;;;;;;;;;;;1022-6680;;978-3-03785-238-5;;;;2011;328-330;;;;;;1701;1704;;10.4028/www.scientific.net/AMR.328-330.1701;;;;;;;WOS:000306989601010;;;;;;
S;"Shen, P; Zhang, J";;"Liu, J; Tian, J; Sang, H; Ma, J";;"Shen, Ping; Zhang, Jing";;;Remote sensing of suspended sediment water research: principles, methods and progress;MIPPR 2011: REMOTE SENSING IMAGE PROCESSING, GEOGRAPHIC INFORMATION SYSTEMS, AND OTHER APPLICATIONS;Proceedings of SPIE;;;;7th Symposium on Multispectral Image Processing and Pattern Recognition (MIPPR) - Remote Sensing Image Processing, Geographic Information Systems, and Other Applications;NOV 04-06, 2011;Guilin, PEOPLES R CHINA;Huazhong Univ Sci & Technol, SPIE, Natl Key Lab Sci & Technol Multi-spectral Informat Proc, Guilin Univ Elect Technol;;;;;;;;;;;;;;;;;;;;;0277-786X;1996-756X;978-0-81948-580-9;;;;2011;8006;;;;;;;;80061V;10.1117/12.899297;;;;;;;WOS:000298378100067;;;;;;
B;"Slihte, A; Osis, J; Donins, U";;"Osis, J; Nikiforova, O";;"Slihte, Armands; Osis, Janis; Donins, Uldis";;;Knowledge Integration for Domain Modeling;MODEL-DRIVEN ARCHITECTURE AND MODEL-DRIVEN SOFTWARE DEVELOPMENT;;;;;3rd International Workshop on Model-Driven Architecture and Modeling-Driven Software Development, MDA & MDSD 2011;JUN 08, 2011;Beijing, PEOPLES R CHINA;Riga Tech Univ, Dept Appl Comp Sci;;;;;;;;;;;;;;;;;;;;;;;978-989-8425-59-1;;;;2011;;;;;;;46;56;;;;;;;;;WOS:000395720900005;;;;;;
S;"Belgiu, G; Banciu, F; Pamintas, E; Carausu, C; Turc, C";;"Nedelcu, D; Slatineanu, L; Mazuru, S; Milocevic, O";;"Belgiu, George; Banciu, Felicia; Pamintas, Eugen; Carausu, Constantin; Turc, Cristian";;;FLEXIBLE MANUFACTURING SYSTEMS MANAGEMENT - ISSUES CONCERNING THE MODELING, SIMULATION AND OPTIMIZATION;MODTECH 2011: NEW FACE OF T.M.C.R., VOL I AND II;International Conference ModTech Proceedings;;;;15th International Conference of Modern Technoliges, Quality and Innovation;MAY 25-27, 2011;Vadul lui Voda, MOLDOVA;Redesign Solutions Iasi, Profess Assoc Modern Mfg Technol, Patis, Serbian Acad Sci & Arts, Inst Tech Sci, Gheorghe Asachi Tech Univ Iasi Romania, Fac Machine Mfg & Ind Management, Dept Machine Mfg Technol, Tech Univ Moldova Chisinau, Dept Machine Mfg Technol;;;;;;;;BANCIU, FELICIA VERONICA/N-2954-2013;BANCIU, FELICIA VERONICA/0000-0001-5246-9829;;;;;;;;;;;;2069-6736;;;;;;2011;;;;;;;77;80;;;;;;;;;WOS:000392260500020;;;;;;
S;"Carausu, C; Albu, A; Stanciu, L; Belgiu, G";;"Nedelcu, D; Slatineanu, L; Mazuru, S; Milocevic, O";;"Carausu, Constantin; Albu, Adriana; Stanciu, Loredana; Belgiu, George";;;MANAGEMENT OF INTELLIGENT MACHINING - AN ARTIFICIAL INTELLIGENCE APPROACH;MODTECH 2011: NEW FACE OF T.M.C.R., VOL I AND II;International Conference ModTech Proceedings;;;;15th International Conference of Modern Technoliges, Quality and Innovation;MAY 25-27, 2011;Vadul lui Voda, MOLDOVA;Redesign Solutions Iasi, Profess Assoc Modern Mfg Technol, Patis, Serbian Acad Sci & Arts, Inst Tech Sci, Gheorghe Asachi Tech Univ Iasi Romania, Fac Machine Mfg & Ind Management, Dept Machine Mfg Technol, Tech Univ Moldova Chisinau, Dept Machine Mfg Technol;;;;;;;;"STANCIU, Loredana/AAT-3447-2020; ALBU, Adriana/U-5271-2017";;;;;;;;;;;;;2069-6736;;;;;;2011;;;;;;;173;176;;;;;;;;;WOS:000392260500044;;;;;;
S;"Turc, CG; Stef, D; Belgiu, G; Rotar, D";;"Nedelcu, D; Slatineanu, L; Mazuru, S; Milocevic, O";;"Turc, Cristian-Gheorghe; Stef, Dorian; Belgiu, George; Rotar, Daniel";;;AN APPLICATION OF FUZZY LOGIC METHODOLOGY FOR WORKPIECES CHOOSING;MODTECH 2011: NEW FACE OF T.M.C.R., VOL I AND II;International Conference ModTech Proceedings;;;;15th International Conference of Modern Technoliges, Quality and Innovation;MAY 25-27, 2011;Vadul lui Voda, MOLDOVA;Redesign Solutions Iasi, Profess Assoc Modern Mfg Technol, Patis, Serbian Acad Sci & Arts, Inst Tech Sci, Gheorghe Asachi Tech Univ Iasi Romania, Fac Machine Mfg & Ind Management, Dept Machine Mfg Technol, Tech Univ Moldova Chisinau, Dept Machine Mfg Technol;;;;;;;;;;;;;;;;;;;;;2069-6736;;;;;;2011;;;;;;;1109;1112;;;;;;;;;WOS:000392260500278;;;;;;
S;"Lavanya, D; Udgata, SK";;"Sombattheera, C; Agarwal, A; Udgata, SK; Lavangnananda, K";;"Lavanya, Dama; Udgata, Siba K.";;;Swarm Intelligence Based Localization in Wireless Sensor Networks;MULTI-DISCIPLINARY TRENDS IN ARTIFICIAL INTELLIGENCE;Lecture Notes in Artificial Intelligence;;;;5th Multi-Disciplinary International Workshop on Artificial Intelligence, MIWAI-2011;DEC 07-09, 2011;Univ Hyderabad, Hyderabad, INDIA;IBM India, Locuz Enterprise Solut Ltd, IDRBT, Winzest;Univ Hyderabad;;;;;;;Udgata, Siba K./U-2992-2019;;;;;;;;;;;;;0302-9743;1611-3349;"978-3-642-25724-7; 978-3-642-25725-4";;;;2011;7080;;;;;;317;328;;;;;;;;;WOS:000308110800028;;;;;;
B;Krishnan, J;;"Laudon, M; Romanowicz, B";;Krishnan, Jay;;;A Wireless Sensor based solution that enables the Enterprise to enable intelligent Energy Monitoring & Management using Artificial intelligence;NANOTECHNOLOGY 2011: BIO SENSORS, INSTRUMENTS, MEDICAL, ENVIRONMENT AND ENERGY, NSTI-NANOTECH 2011, VOL 3;;;;;NSTI Nanotechnology Conference and Expo;JUN 13-16, 2011;Boston, MA;Clean Technol & Sustainable Ind Org, European Patent Off, Greenberg Traurig, Innovat & Mat Sci Inst, Jackson Walker LLP, Linde Nanomaterials, Lockheed Martin, Nano Sci & Technol Inst, Nano Tech Japan, NanoEurope Fair & Conf, Nanpolis Suzhou, Suzhou Nanotech Co Ltd, Natl Inst Standards & Technol, Ctr Nanoscale Sci & Technol, Fraunhofer, Res Germany, TechConnect, Technol Innovat Program, Canadian Trade Commiss Serv, Italian Trade Commiss;;;;;;;;;;;;;;;;;;;;;;;978-1-4398-7138-6;;;;2011;;;;;;;799;800;;;;;;;;;WOS:000394061000208;;;;;;
S;"Balahur, A; Hermida, JM; Montoyo, A; Munoz, R";;"Munoz, R; Montoyo, A; Metais, E";;"Balahur, Alexandra; Hermida, Jesus M.; Montoyo, Andres; Munoz, Rafael";;;EmotiNet: A Knowledge Base for Emotion Detection in Text Built on the Appraisal Theories;NATURAL LANGUAGE PROCESSING AND INFORMATION SYSTEMS;Lecture Notes in Computer Science;;;;16th International Conference on Applications of Natural Language to Information Systems (NLDB);JUN 28-30, 2011;Univ Alicante, Alicante, SPAIN;Conseller Educacio Generalitat Valenciana;Univ Alicante;;;;;;;"Montoyo, Andres/H-2531-2015; Munoz, Rafael/H-3101-2015";"Montoyo, Andres/0000-0002-3076-0890; Munoz, Rafael/0000-0001-8127-9012";;;;;;;;;;;;0302-9743;1611-3349;978-3-642-22326-6;;;;2011;6716;;;;;;27;39;;;;;;;;;WOS:000392116900003;;;;;;
B;"Citko, W; Sienko, W";;"Madani, K; Kacprzyk, J; Filipe, J";;"Citko, Wieslaw; Sienko, Wieslaw";;;HAMILTONIAN NEURAL NETWORK-BASED ORTHOGONAL FILTERS A Basis for Artificial Intelligence;NCTA 2011: PROCEEDINGS OF THE INTERNATIONAL CONFERENCE ON NEURAL COMPUTATION THEORY AND APPLICATIONS;;;;;International Conference on Neural Computation Theory and Applications;OCT 24-26, 2011;Univ Paris Est Creteil, Paris, FRANCE;Inst Syst & Technol Informat Control and Commun;Univ Paris Est Creteil;;;;;;;;Citko, Wieslaw/0000-0003-3517-4046;;;;;;;;;;;;;;978-989-8425-84-3;;;;2011;;;;;;;124;127;;;;;;;;;WOS:000392350600022;;;;;;
B;Zhao, QF;;"Madani, K; Kacprzyk, J; Filipe, J";;Zhao, Qiangfu;;;AWARENESS COMPUTING: WHAT, WHY, AND HOW?;NCTA 2011: PROCEEDINGS OF THE INTERNATIONAL CONFERENCE ON NEURAL COMPUTATION THEORY AND APPLICATIONS;;;;;International Conference on Neural Computation Theory and Applications;OCT 24-26, 2011;Univ Paris Est Creteil, Paris, FRANCE;Inst Syst & Technologies Informat Control & Commun;Univ Paris Est Creteil;;;;;;;;;;;;;;;;;;;;;;978-989-8425-84-3;;;;2011;;;;;;;IS5;IS10;;;;;;;;;WOS:000392350600001;;;;;;
S;"Tzeng, J; Chen, YH";;Yanqun, Z;;"Tzeng, Jengnan; Chen, Yen-Hung";;;Classification on Ambiguous Components via Association Rules;NETWORK AND ELECTRONICS ENGINEERING;International Proceedings of Computer Science and Information Technology;;;;International Conference on Network and Electronics Engineering (ICNEE 2011);SEP 16-18, 2011;Singapore, SINGAPORE;Aim Shams Univ, Singapore Inst Elect, Int Assoc Comp Sci & Informat Technol, Hong Kong Univ;;;;;;;;;;;;;;;;;;;;;2010-460X;;978-981-08-9915-8;;;;2011;11;;;;;;49;52;;;;;;;;;WOS:000400801600010;;;;;;
S;"Ghomi, M; Moeti, MT; Azimi, M";;Yanqun, Z;;"Ghomi, Mohammad; Moeti, Mohammad Taghi; Azimi, Mohammad";;;Introduction of Neural Network Model and Fuzzy Regression Method for Short Term Load Forecasting in The Center Regional of IRAN;NETWORK AND ELECTRONICS ENGINEERING;International Proceedings of Computer Science and Information Technology;;;;International Conference on Network and Electronics Engineering (ICNEE 2011);SEP 16-18, 2011;Singapore, SINGAPORE;Aim Shams Univ, Singapore Inst Elect, Int Assoc Comp Sci & Informat Technol, Hong Kong Univ;;;;;;;;;;;;;;;;;;;;;2010-460X;;978-981-08-9915-8;;;;2011;11;;;;;;87;92;;;;;;;;;WOS:000400801600017;;;;;;
S;"Palmieri, F; Ciuonzo, D";;"Apolloni, B; Bassis, S; Esposito, A; Morabito, CF";;"Palmieri, Francesco; Ciuonzo, Domenico";;;Data Fusion with Entropic Priors;NEURAL NETS WIRN10;Frontiers in Artificial Intelligence and Applications;;;;20th Italian Workshop on Neural Nets of the Italian-Neural-Network-Society (SIREN);2010;Vietri sul Mare, ITALY;Italian Neural Network Soc;;;;;;;;Ciuonzo, Domenico/M-8761-2017;Ciuonzo, Domenico/0000-0002-6230-2958;;;;;;;;;;;;0922-6389;;978-1-60750-692-8;;;;2011;226;;;;;;107;114;;10.3233/978-1-60750-692-8-107;;;;;;;WOS:000325223000012;;;;;;
S;"Rossini, NA; Quadri, C; Borghese, NA";;"Apolloni, B; Bassis, S; Esposito, A; Morabito, CF";;"Rossini, Nicole Alicia; Quadri, Christian; Borghese, N. Alberto";;;Clever Pac-man;Neural Nets WIRN11;Frontiers in Artificial Intelligence and Applications;;;;21st Italian Workshop on Neural Nets (WIRN);2011;Vietri sul Mare, ITALY;;;;;;;;;;;;;;;;;;;;;;0922-6389;;"978-1-60750-972-1; 978-1-60750-971-4";;;;2011;234;;;;;;11;19;;10.3233/978-1-60750-972-1-11;;;;;;;WOS:000348844500002;;;;;;
S;"Palmieri, FAN; Ciuonzo, D; Mattera, D; Romano, G; Salvo Rossi, P";;"Apolloni, B; Bassis, S; Esposito, A; Morabito, CF";;"Palmieri, Francesco A. N.; Ciuonzo, Domenico; Mattera, Davide; Romano, Gianmarco; Salvo Rossi, Pierluigi";;;From Examples to Bayesian Inference;NEURAL NETS WIRN11;Frontiers in Artificial Intelligence and Applications;;;;21st Italian Workshop on Neural Nets (WIRN);2011;Vietri sul Mare, ITALY;;;;;;;;;"Ciuonzo, Domenico/M-8761-2017; Mattera, Davide/ABH-1771-2020; Romano, Gianmarco/R-5444-2016";"Ciuonzo, Domenico/0000-0002-6230-2958; Mattera, Davide/0000-0001-6179-0155; Romano, Gianmarco/0000-0002-8502-1526";;;;;;;;;;;;0922-6389;;"978-1-60750-972-1; 978-1-60750-971-4";;;;2011;234;;;;;;97;+;;10.3233/978-1-60750-972-1-97;;;;;;;WOS:000348844500011;;;;;;
S;"Chen, R; Xu, JJ; Song, YJ; Deng, W; Li, YH";;"Luo, XF; Cao, YW; Yang, B; Liu, JX; Ye, FY";;"Chen, Rong; Xu, Junjie; Song, Yingjie; Deng, Wu; Li, Yanheng";;;Model-Based Cognitive Diagnosis of Students' Test Performance in an E-Learning Environment;NEW HORIZONS IN WEB-BASED LEARNING: ICWL 2010 WORKSHOPS;Lecture Notes in Computer Science;;;;1st International Workshop on Cognitive-Based Interactive Computing and Web Wisdom;DEC 07-11, 2010;Shanghai, PEOPLES R CHINA;;;;;;;;;"wu, deng/AAE-1480-2019; Chen, Rong/AAM-2436-2020";Chen, Rong/0000-0001-5848-6398;;;;;;;;;;;;0302-9743;;978-3-642-20538-5;;;;2011;6537;;;;;;129;138;;;;;;;;;WOS:000297034300015;;;;;;
B;"Luhan, J; Novotna, V";;"Rukovansky, I; Osmera, P";;"Luhan, Jan; Novotna, Veronika";;;USE OF GENETIC ALGORYTHMS IN ECONOMIC DECISION MAKING PROCESSES;NINTH INTERNATIONAL CONFERENCE ON SOFT COMPUTING APPLIED IN COMPUTER AND ECONOMIC ENVIRONMENTS, ICSC 2011;;;;;9th International Conference on Soft Computing Applied in Computer and Economic Environments (ICSC 2011);JAN 21, 2011;Hodonin, CZECH REPUBLIC;European Polytechn Inst;;;;;;;;;;;;;;;;;;;;;;;978-80-7314-221-6;;;;2011;;;;;;;55;59;;;;;;;;;WOS:000393149800008;;;;;;
B;"Marques, VM; Roseiro, L; Reis, C; Machado, JAT";;"Machado, JAT; Luo, ACJ; Barbosa, RS; Silva, MF; Figueiredo, LB";;"Marques, Viriato M.; Roseiro, Luis; Reis, Cecilia; Tenreiro Machado, J. A.";;;Application of Computational Intelligence to Engineering;NONLINEAR SCIENCE AND COMPLEXITY;;;;;2nd Conference on Nonlinear Science and Complexity (NSC'08);JUL 28-31, 2008;Porto, PORTUGAL;;;;;;;;;Machado, J. A. Tenreiro/M-2173-2013;"Machado, J. A. Tenreiro/0000-0003-4274-4879; Roseiro, Luis/0000-0001-6043-6007";;;;;;;;;;;;;;978-90-481-9883-2;;;;2011;;;;;;;337;345;;10.1007/978-90-481-9884-9_39;;;;;;;WOS:000395214800039;;;;;;
B;"Meinecke, G; Ratmeyer, V; Renken, J";;;IEEE;"Meinecke, Gerrit; Ratmeyer, Volker; Renken, Jens";;;HYBRID-ROV Development of a new underwater vehicle for high-risk areas;OCEANS 2011;;;;;MTS/IEEE OCEANS Conference;SEP 19-22, 2011;Kona, HI;Marine Technol Soc (MTS), IEEE, OES;;;;;;;;;;;;;;;;;;;;;;;978-0-933957-39-8;;;;2011;;;;;;;;;;;;;;;;;WOS:000299005800022;;;;;;
S;"Lakatos, ES; Gazdac, RM; Dan, V";;Lu, H;;"Lakatos, Elena-Simina; Gazdac, Roxana-Mirela; Dan, Viorel";;;Using the Web by Finnish SMEs for corporate social responsibility activities;OPTIMIZATION OF THE ROBOTS AND MANIPULATORS;International Proceedings of Computer Science and Information Technology;;;;6th IEEE/IACSIT International Conference on Optimization of the Robots and Manipulators (OPTIROB 2011);MAY 26-28, 2011;Sinaia, ROMANIA;Univ POLITEHNICA Bucharest, Int Assoc Comp Sci & Informat Technol, IEEE Soc;;;;;;;;;;;;;;;;;;;;;2010-460X;;978-981-08-8906-7;;;;2011;8;;;;;;169;173;;;;;;;;;WOS:000400801300031;;;;;;
S;"Krys, S; Jankowski, S";;Romaniuk, RS;;"Krys, Sebastian; Jankowski, Stanislaw";;;Extended Hierarchical Temporal Memory for Visual Object Tracking;PHOTONICS APPLICATIONS IN ASTRONOMY, COMMUNICATIONS, INDUSTRY, AND HIGH-ENERGY PHYSICS EXPERIMENTS 2011;Proceedings of SPIE;;;;Conference on Photonics Applications in Astronomy, Communications, Industry, and High-Energy Physics Experiments;MAY 23-29, 2011;Wilga, POLAND;Inst Elect Syst, Fac Elect & Informat Technol, Warsaw Univ Technol, Photon Soc Poland (PSP), Polish Acad Sci, Comm Elect & Telecommun, European Coordinat Accelerator R&D (EU FP7) (EuCARD), IEEE Poland Sect, Polish Comm Optoelect SEP (PKOpto);;;;;;;;;;;;;;;;;;;;;0277-786X;;978-0-81948-582-3;;;;2011;8008;;;;;;;;80081C;10.1117/12.907004;;;;;;;WOS:000297520000047;;;;;;
S;"Porwolik, M; Mulawka, J";;Romaniuk, RS;;"Porwolik, Marek; Mulawka, Jan";;;Considerations on conceptual knowledge representation;PHOTONICS APPLICATIONS IN ASTRONOMY, COMMUNICATIONS, INDUSTRY, AND HIGH-ENERGY PHYSICS EXPERIMENTS 2011;Proceedings of SPIE;;;;Conference on Photonics Applications in Astronomy, Communications, Industry, and High-Energy Physics Experiments;MAY 23-29, 2011;Wilga, POLAND;Inst Elect Syst, Fac Elect & Informat Technol, Warsaw Univ Technol, Photon Soc Poland (PSP), Polish Acad Sci, Comm Elect & Telecommun, European Coordinat Accelerator R&D (EU FP7) (EuCARD), IEEE Poland Sect, Polish Comm Optoelect SEP (PKOpto);;;;;;;;;;;;;;;;;;;;;0277-786X;;978-0-81948-582-3;;;;2011;8008;;;;;;;;800804;10.1117/12.905490;;;;;;;WOS:000297520000003;;;;;;
S;"Tataj, E; Tomanek, R; Mulawka, J";;Romaniuk, RS;;"Tataj, Emanuel; Tomanek, Roman; Mulawka, Jan";;;Ontological engineering versus metaphysics;PHOTONICS APPLICATIONS IN ASTRONOMY, COMMUNICATIONS, INDUSTRY, AND HIGH-ENERGY PHYSICS EXPERIMENTS 2011;Proceedings of SPIE;;;;Conference on Photonics Applications in Astronomy, Communications, Industry, and High-Energy Physics Experiments;MAY 23-29, 2011;Wilga, POLAND;Inst Elect Syst, Fac Elect & Informat Technol, Warsaw Univ Technol, Photon Soc Poland (PSP), Polish Acad Sci, Comm Elect & Telecommun, European Coordinat Accelerator R&D (EU FP7) (EuCARD), IEEE Poland Sect, Polish Comm Optoelect SEP (PKOpto);;;;;;;;Romaniuk, Ryszard S/B-9140-2011;"Romaniuk, Ryszard S/0000-0002-5710-4041; Tomanek, Roman/0000-0002-5531-8580";;;;;;;;;;;;0277-786X;;978-0-81948-582-3;;;;2011;8008;;;;;;;;800803;10.1117/12.905443;;;;;;;WOS:000297520000002;;;;;;
S;"Wasiewicz, P; Skalski, M";;Romaniuk, RS;;"Wasiewicz, P.; Skalski, M.";;;On insomnia analysis using methods of artificial intelligence;PHOTONICS APPLICATIONS IN ASTRONOMY, COMMUNICATIONS, INDUSTRY, AND HIGH-ENERGY PHYSICS EXPERIMENTS 2011;Proceedings of SPIE;;;;Conference on Photonics Applications in Astronomy, Communications, Industry, and High-Energy Physics Experiments;MAY 23-29, 2011;Wilga, POLAND;Inst Elect Syst, Fac Elect & Informat Technol, Warsaw Univ Technol, Photon Soc Poland (PSP), Polish Acad Sci, Comm Elect & Telecommun, European Coordinat Accelerator R&D (EU FP7) (EuCARD), IEEE Poland Sect, Polish Comm Optoelect SEP (PKOpto);;;;;;;;;;;;;;;;;;;;;0277-786X;1996-756X;978-0-81948-582-3;;;;2011;8008;;;;;;;;80081L;10.1117/12.905590;;;;;;;WOS:000297520000056;;;;;;
S;"Jadin, MS; Taib, S; Kabir, S";;;Electromagnet Acad;"Jadin, Mohd Shawal; Taib, Soib; Kabir, Shahid";;;Infrared Thermography for Assessing and Monitoring Electrical Components within Concrete Structures;PIERS 2011 MARRAKESH: PROGRESS IN ELECTROMAGNETICS RESEARCH SYMPOSIUM;Progress in Electromagnetics Research Symposium;;;;Progress in Electromagnetics Research Symposium (PIERS);MAR 20-23, 2011;Marrakesh, MOROCCO;EPL, CST, DIRECTEVENT, CNRS, SUPELEC, Univ Paris W, Natl Univ Singapore, Univ Elect Sci & Technol China, Zhejiang Univ, Lab Genie Electrique Paris, Energy, Mech & Electromagnet Lab, Zhejiang Univ, Electromagnet Acad;;;;;;;;"jadin, mohd shawal/N-1553-2019; Shawal, Mohd/I-5518-2013";"jadin, mohd shawal/0000-0001-6253-7821; Shawal, Mohd/0000-0001-6253-7821";;;;;;;;;;;;1559-9450;;978-1-934142-16-5;;;;2011;;;;;;;786;789;;;;;;;;;WOS:000332513000174;;;;;;
S;"Liu, CL; Ding, FZ; Wang, GC; Gao, F; Ding, F; Bao, CM; Guo, X; Li, CJ; Yi, ZJ";;"Wang, Y; Li, T";;"Liu, Changliang; Ding, Fangzheng; Wang, Guchang; Gao, Fei; Ding, Fan; Bao, Chuanmei; Guo, Xiang; Li, Chunjun; Yi, Zhejing";;;Pint-Sized Airborne Fire Control System of UAV and its Key Technology;PRACTICAL APPLICATIONS OF INTELLIGENT SYSTEMS;Advances in Intelligent and Soft Computing;;;;6th International Conference on Intelligent Systems and Knowledge Engineering (ISKE 2011);DEC 15-17, 2011;Shanghai, PEOPLES R CHINA;Shanghai Jiao Tong Univ, California State Univ, SW Jiaotong Univ, Belgian Nucl Res Ctr;;;;;;;;;;;;;;;;;;;;;1867-5662;;978-3-642-25657-8;;;;2011;124;;;;;;477;+;;;;;;;;;WOS:000307258900057;;;;;;
J;Milerius, N;;;;Milerius, Nerijus;;;VISIONS OF UTOPIA AND DYSTOPIA IN CINEMA. THE PHILOSOPHICAL PRESUPPOSITIONS OF THE BANAL GENRE;PROBLEMOS;;;;;;;;;;;;;;;;;;;;;;;;;;;;;1392-1126;;;;;;2011;79;;;;;;81;89;;10.15388/Problemos.2011.0.1325;;;;;;;WOS:000289008800007;;;;;;
B;Nahodil, P;;"Burczynski, T; Kolodziej, J; Byrski, A; Carvalho, M";;Nahodil, Pavel;;;LEVELS OF CONSCIOUS AND UNCONSCIOUS ANTICIPATORY BEHAVIOUR FOR ARTIFICIAL CREATURES;PROCEEDINGS - 25TH EUROPEAN CONFERENCE ON MODELLING AND SIMULATION, ECMS 2011;;;;;25th European Conference on Modeling and Simulation (ECMS 20110;JUN 07-10, 2011;Krakow, POLAND;European Council Model & Simulat, Cracow Univ Technol, Univ Bielsko Biala, ABB Corp Res, NASK Res & Acad Computer Network, Fido Intelligence Sp z o o, Dwor w Tomaszowicac, Krakowskie Centrum Konferencyjne, Univ Bielsko Biala, Akademia Techniczno Humanistyczna w Bielsku Bialej, Inst Elect & Elect Engn, German Speak Simulat Soc, Federat European Simulat Soc, Latvian Simulat Soc;;;;;;;;;;;;;;;;;;;;;;;978-0-9564944-2-9;;;;2011;;;;;;;98;104;;;;;;;;;WOS:000392767500015;;;;;;
B;"Li, YW; Wang, XY; Wang, X";;"Zhang, H; Wang, W";;"Li, Yawen; Wang, Xiangyun; Wang, Xue";;;E-Commerce on-line Catering Reserving and Ordering System Based on Mobile Intelligent Terminal;PROCEEDINGS OF 2011 INTERNATIONAL CONFERENCE ON ADVANCED INTELLIGENCE AND AWARENESS INTERNET, IET AIAI2011;;;;;International Conference on Advanced Intelligence and Awareness Internet (AIAI 2011);OCT 28-30, 2011;Shenzhen, PEOPLES R CHINA;Inst Engn & Technol, Chinese Assoc Artificial Intelligence, Beijing Univ Posts & Telecommunicat, Nat Sci Fdn China, Beijing Jiaotong Univ, China Communicat Magazine Co Ltd;;;;;;;;;;;;;;;;;;;;;;;978-1-84919-471-6;;;;2011;;;;;;;123;126;;;;;;;;;WOS:000391155900025;;;;;;
B;"Zambrano, G; Pach, C; Adam, E; Berger, T; Trentesaux, D";;"Benyoucef, L; Trentesaux, D; Artiba, A; Rezg, N";;"Zambrano, Gabriel; Pach, Cyrille; Adam, Emmanuel; Berger, Thierry; Trentesaux, Damien";;;Myopic Behavior in Heterarchical Control of FMS;PROCEEDINGS OF INTERNATIONAL CONFERENCE ON INDUSTRIAL ENGINEERING AND SYSTEMS MANAGEMENT (IESM'2011): INNOVATIVE APPROACHES AND TECHNOLOGIES FOR NETWORKED MANUFACTURING ENTERPRISES MANAGEMENT;;;;;4th International Conference on Industrial Engineering and Systems Management (IESM) - Innovative Approaches and Technologies for Networked Manufacturing Enterprises Management;MAY 25-27, 2011;Metz, FRANCE;Int Inst Innovat, Ind Engn & Entrepreneurship, ENIM, INRIA, Igipm, Conseil Gen Moselle, Metz Metropole, Univ Valenciennes Hainaut Cambresis, Lab Automatique Mecanique & Informatique Ind & Humaines, Thermique Ecoulement Mecanique Materiaux Mise Forme Prod, Gdr Macs, IBM, Innovat Prod Machines & Syst;;;;;;;;;ADAM, Emmanuel/0000-0003-4052-4135;;;;;;;;;;;;;;978-2-9600532-3-4;;;;2011;;;;;;;1352;1362;;;;;;;;;WOS:000394882300140;;;;;;
B;"Rodriguez, E; Edwards, J; Facundo, A";;"Lehner, F; Bredl, K";;"Rodriguez, Eduardo; Edwards, John; Facundo, Angel";;;Country Strategic Risk and Knowledge Management: A Proposed Framework for Improvement;PROCEEDINGS OF THE 12TH EUROPEAN CONFERENCE ON KNOWLEDGE MANAGEMENT, VOLS 1 AND 2;;;;;12th Annual European Conference on Knowledge Management (ECKM);SEP 01-02, 2011;Univ Passau, Passau, GERMANY;;Univ Passau;;;;;;;Edwards, John Steven/AAC-9878-2020;Edwards, John Steven/0000-0003-3979-017X;;;;;;;;;;;;;;978-1-908272-09-6;;;;2011;;;;;;;836;848;;;;;;;;;WOS:000300379200094;;;;;;
B;"Elarabi, H; Mohamed, M";;"Quadros, C; Jacobsz, SW";;"Elarabi, H.; Mohamed, M.";;;The Potential of Using Artificial Neural Networks for Prediction of Blue Nile Soil Profile in Khartoum State;PROCEEDINGS OF THE 15TH AFRICAN REGIONAL CONFERENCE ON SOIL MECHANICS AND GEOTECHNICAL ENGINEERING: RESOURCE AND INFRASTRUCTURE GEOTECHNICS IN AFRICA: PUTTING THEORY INTO PRACTICE;;;;;15th African Regional Conference on Soil Mechanics and Geotechnical Engineering (ARCSMGE);JUL 18-21, 2011;Maputo, MOZAMBIQUE;Mozambican Geotechn Soc, Road Fund, TECNICA Engenheiros Consultores Ltd, CETA Construcoes & Servicos S A, Royal Embassy Denmark, Teixeira Duarte Engn & Construcoes S A, Franki Africa, Dura Soletanche Bachy, Soares Costa, Maccaferri So Africa, Geokon, COBA Consultores Engn & Ambiente, ARQ Consulting Engineers, COLLINS Sistemas Aguas Ltd, Modena Design Ltd, It Com Tecnologias Informacao & Comunicacao, HUESKER, SINAVIA Sinalizacao & Pintura Ltd, Jones & Wagener Consulting Civil Engineers, Gundle GeoSynthet Pty Ltd, ARA SUL, Univ Eduardo Mondlane;;;;;;;;;;;;;;;;;;;;;;;"978-1-60750-778-9; 978-1-60750-777-2";;;;2011;;;;;;;580;586;;10.3233/978-1-60750-778-9-580;;;;;;;WOS:000393688000076;;;;;;
B;"Champion, EM; Dekker, A";;"Herr, CM; Gu, N; Roudavski, S; Schnabel, MA";;"Champion, Erik M.; Dekker, Andrew";;;INDIRECT BIOFED ARCHITECTURE Strategies to best utilise biofeedback tools and interaction metaphors within digital architectural environments;PROCEEDINGS OF THE 16TH INTERNATIONAL CONFERENCE ON COMPUTER-AIDED ARCHITECTURAL DESIGN RESEARCH IN ASIA (CAADRIA 2011): CIRCUIT BENDING, BREAKING AND MENDING;;;;;16th International Conference on Computer-Aided Architectural Design Research in Asia (CAADRIA);APR 27-29, 2011;Univ Newcastle, Sch Architecture & Built Environm, Callaghan, AUSTRALIA;;Univ Newcastle, Sch Architecture & Built Environm;;;;;;;"Champion, Erik M/J-8471-2014; Champion, Erik Malcolm/R-7080-2019";"Champion, Erik M/0000-0002-5362-6176; Champion, Erik Malcolm/0000-0002-5362-6176";;;;;;;;;;;;;;978-988-19026-2-7;;;;2011;;;;;;;241;250;;;;;;;;;WOS:000351503300024;;;;;;
