S;"Kong, ZD; Mettler, B";;;IEEE;"Kong, Zhaodan; Mettler, Bernie";;;Foundations of Formal Language for Humans and Artificial Systems Based on Intrinsic Structure in Spatial Behavior;2011 IEEE/RSJ INTERNATIONAL CONFERENCE ON INTELLIGENT ROBOTS AND SYSTEMS;IEEE International Conference on Intelligent Robots and Systems;;;;IEEE/RSJ International Conference on Intelligent Robots and Systems;SEP 25-30, 2011;San Francisco, CA;IEEE, Robot Soc Japan (RSJ), BOSCH, HONDA, KUKA, SRI Int, ABB, Willow Garage, ALDEBARAN, Google, INTUITIVE Surg, SCHUNK, IEEE Ind Elect Soc (IES), Soc Instrument & Control Engineers (SICE), New Technol Fdn (NTF), IEEE Robot & Automat Soc (RAS), Inst Control, Robto & Syst (ICROS);;;;;;;;Kong, Zhaodan/E-9362-2015;"Kong, Zhaodan/0000-0002-2493-1366; Mettler, Berenice/0000-0002-3824-7995";;;;;;;;;;;;2153-0858;;978-1-61284-455-8;;;;2011;;;;;;;3093;3100;;;;;;;;;WOS:000297477503068;;;;;;
B;"Jain, SK; Saxena, D; Singh, SN";;;IEEE;"Jain, Sachin K.; Saxena, D.; Singh, S. N.";;;Adaptive Wavelet Neural Network Based Harmonic Estimation of Single-Phase Systems;2011 INTERNATIONAL CONFERENCE AND UTILITY EXHIBITION ON POWER AND ENERGY SYSTEMS: ISSUES & PROSPECTS FOR ASIA (ICUE);;;;;International Conference and Utility on Power and Energy Systems - Issues and Prospects for Asia (ICUE);SEP 28-30, 2011;Pattaya City, THAILAND;Asian Inst Technol, Prov Elect Author;;;;;;;;Jain, Sachin Kumar/B-5484-2012;Jain, Sachin Kumar/0000-0002-6533-2474;;;;;;;;;;;;;;"978-1-4673-6008-1; 978-1-4673-6006-7";;;;2011;;;;;;;;;;;;;;;;;WOS:000320469800058;;;;;;
B;"Mi, LY; Luo, X";;Hu, J;;"Mi, Liying; Luo, Xin";;;An Overview of Research Progress on Chinese-Japanese Machine Translation;2011 INTERNATIONAL CONFERENCE ON AEROSPACE ENGINEERING AND INFORMATION TECHNOLOGY (AEIT 2011);;;;;International Conference on Aerospace Engineering and Information Technology;MAY 05-06, 2011;Beijing, PEOPLES R CHINA;Int Ind Elect Ctr Hong Kong, Opt Valley Software Park;;;;;;;;;;;;;;;;;;;;;;;978-988-19116-3-6;;;;2011;;;;;;;305;311;;;;;;;;;WOS:000297656500055;;;;;;
B;"Zhou, HR; Liu, CY; Zhang, C; Zhang, Y";;Guo, X;;"Zhou, Huaren; Liu, Changyu; Zhang, Chun; Zhang, Yan";;;Rescue Artificial Intelligence Assistant Decision-Making System;2011 INTERNATIONAL CONFERENCE ON ECONOMIC AND INFORMATION MANAGEMENT (ICEIM 2011);;;;;International Conference on Economic and Information Management (ICEIM 2011);DEC 03-04, 2011;Beijing, PEOPLES R CHINA;Int Res Assoc Informat & Comp Sci;;;;;;;;;;;;;;;;;;;;;;;978-988-15121-2-3;;;;2011;;;;;;;47;49;;;;;;;;;WOS:000393147600013;;;;;;
B;"Meng, F; Zheng, H; Yu, ZZ";;;IEEE;"Meng, Faner; Zheng, Heng; Yu, Zhezhou";;;Extracting and Recognition of Print Code on Beer Bottle Based on Regional Analysis;2011 INTERNATIONAL CONFERENCE ON ELECTRONICS, COMMUNICATIONS AND CONTROL (ICECC);;;;;IEEE International Conference on Electronics, Communications and Control (ICECC);SEP 09-11, 2011;Ningbo, PEOPLES R CHINA;IEEE, Ningbo Univ, Key Lab Sci & Tech Natl Def (KLSTND);;;;;;;;;;;;;;;;;;;;;;;978-1-4577-0321-8;;;;2011;;;;;;;3746;3749;;;;;;;;;WOS:000298656803208;;;;;;
S;Li, YX;;Zhou, X;;Li, Yuxia;;;RETRACTED: The Application of Apriori Algorithm in the Area of Association Rules (Retracted Article);2011 INTERNATIONAL CONFERENCE ON ENERGY AND ENVIRONMENTAL SCIENCE-ICEES 2011;Energy Procedia;;;;International Conference on Energy and Environmental Science (ICEES);OCT, 2011;Singapore, SINGAPORE;Singapore Inst Elect (SIE);;;;;;;;;;;;;;;;;;;;;1876-6102;;;;;;2011;11;;;;;;1610;1615;;10.1016/j.egypro.2011.10.437;;;;;;;WOS:000299096401094;;;;;;
S;"Yu, J; Hu, ZY";;Zhou, X;;"Yu, Jun; Hu, Zhiyi";;;RETRACTED: Design and Simulation of Soccer Robots and Field Scenarios (Retracted Article);2011 INTERNATIONAL CONFERENCE ON ENERGY AND ENVIRONMENTAL SCIENCE-ICEES 2011;Energy Procedia;;;;International Conference on Energy and Environmental Science (ICEES);OCT, 2011;Singapore, SINGAPORE;Singapore Inst Elect (SIE);;;;;;;;;;;;;;;;;;;;;1876-6102;;;;;;2011;11;;;;;;1929;1935;;10.1016/j.egypro.2011.10.486;;;;;;;WOS:000299096401143;;;;;;
S;"Dong, XY; Yue, XF";;Zhou, X;;"Dong, Xueyan; Yue, Xiaofeng";;;RETRACTED: Based on wavelet transform image reconstruction to study raindrops spectrum image processing system (Retracted Article);2011 INTERNATIONAL CONFERENCE ON ENERGY AND ENVIRONMENTAL SCIENCE-ICEES 2011;Energy Procedia;;;;International Conference on Energy and Environmental Science (ICEES);OCT, 2011;Singapore, SINGAPORE;Singapore Inst Elect (SIE);;;;;;;;;;;;;;;;;;;;;1876-6102;;;;;;2011;11;;;;;;;;;10.1016/j.egypro.2011.10.339;;;;;;;WOS:000299096400139;;;;;;
S;"Shen, B; Ouyang, HB";;Zhou, X;;"Shen Bin; Ouyang Hua-bing";;;RETRACTED: Research on the intelligent process planning technology based on STEP-NC (Retracted Article);2011 INTERNATIONAL CONFERENCE ON ENERGY AND ENVIRONMENTAL SCIENCE-ICEES 2011;Energy Procedia;;;;International Conference on Energy and Environmental Science (ICEES);OCT, 2011;Singapore, SINGAPORE;Singapore Inst Elect (SIE);;;;;;;;;;;;;;;;;;;;;1876-6102;;;;;;2011;11;;;;;;;;;10.1016/j.egypro.2011.10.267;;;;;;;WOS:000299096400067;;;;;;
B;Dong, YH;;Esa, R;;Dong Yinghong;;;The Research Based on Face Detection and Location System;2011 INTERNATIONAL CONFERENCE ON FUTURE COMPUTER SCIENCE AND APPLICATION (FCSA 2011), VOL 1;;;;;International Conference on Future Computer Science and Application (FCSA 2011);JUL 16-17, 2011;Kota Kinabalu, MALAYSIA;Univ Malaya, Wuhan Univ, China Univ Geosciences, Huazhong Normal Univ, Int Ind Elect Ctr Hong Kong;;;;;;;;;;;;;;;;;;;;;;;978-988-19116-9-8;;;;2011;;;;;;;502;505;;;;;;;;;WOS:000393845100124;;;;;;
B;"Wang, YB; Tan, L";;Esa, R;;"Wang, Yanbai; Tan, Lu";;;The study of the Interactive Image Retrieval;2011 INTERNATIONAL CONFERENCE ON FUTURE COMPUTER SCIENCE AND APPLICATION (FCSA 2011), VOL 3;;;;;International Conference on Future Computer Science and Application (FCSA 2011);JUL 16-17, 2011;Kota Kinabalu, MALAYSIA;Univ Malaya, Wuhan Univ, China Univ Geosciences, Huazhong Normal Univ, Int Ind Elect Ctr Hong Kong;;;;;;;;;;;;;;;;;;;;;;;978-988-19116-9-8;;;;2011;;;;;;;280;283;;;;;;;;;WOS:000392456900068;;;;;;
B;"Liu, XB; Yang, A";;Zhou, M;;"Liu, Xiabi; Yang, Ali";;;Teaching Artificial Intelligence with a Website Focusing on System of Artificial Intelligence Concepts;2011 INTERNATIONAL CONFERENCE ON FUTURE COMPUTERS IN EDUCATION (ICFCE 2011), VOL III;;;;;International Conference on Future Computers in Education (ICFCE 2011);JUN 25-26, 2011;Xiamen, PEOPLES R CHINA;Hubei Univ Technol, Int Ind Elect Ctr;;;;;;;;;;;;;;;;;;;;;;;978-988-19116-6-7;;;;2011;;;;;;;86;89;;;;;;;;;WOS:000297605200024;;;;;;
B;"Wang, LJ; Lu, WG; Zhu, JY";;Zhou, M;;"Wang, Li-juan; Lu, Wan-gang; Zhu, Jia-yuan";;;Design of Aerobics Intelligent Tutoring System Model And Implementation of Its Core Technologies;2011 INTERNATIONAL CONFERENCE ON FUTURE COMPUTERS IN EDUCATION (ICFCE 2011), VOL III;;;;;International Conference on Future Computers in Education (ICFCE 2011);JUN 25-26, 2011;Xiamen, PEOPLES R CHINA;Hubei Univ Technol, Int Ind Elect Ctr;;;;;;;;;;;;;;;;;;;;;;;978-988-19116-6-7;;;;2011;;;;;;;305;308;;;;;;;;;WOS:000297605200083;;;;;;
B;"Chen, QZ; Yao, M; Li, YD; Huang, WD; Liu, WC";;Zhou, M;;"Chen Qing-zhang; Yao Min; Li Yi-dong; Huang Wan-de; Liu Wei-chao";;;Development and Functional Components of Teaching System Assisted by Intellectual Computers;2011 INTERNATIONAL CONFERENCE ON FUTURE COMPUTERS IN EDUCATION (ICFCE 2011), VOL III;;;;;International Conference on Future Computers in Education (ICFCE 2011);JUN 25-26, 2011;Xiamen, PEOPLES R CHINA;Hubei Univ Technol, Int Ind Elect Ctr;;;;;;;;chen, qingzhang/H-2823-2012;;;;;;;;;;;;;;;978-988-19116-6-7;;;;2011;;;;;;;475;478;;;;;;;;;WOS:000297605200128;;;;;;
S;"Yang, F; Zhang, Y";;"Esa, R; Se, L";;"Yang, Fei; Zhang, Yong";;;Distributed Simulation Environment for the Artificial Intelligence Community;2011 INTERNATIONAL CONFERENCE ON FUTURE INFORMATION ENGINEERING (ICFIE 2011);Lecture Notes in Information Technology;;;;International Conference on Future Information Engineering (ICFIE 2011);SEP 30-OCT 01, 2011;Bangkok, THAILAND;;;;;;;;;;;;;;;;;;;;;;2070-1918;;978-1-61275-990-6;;;;2011;8;;;;;;238;242;;;;;;;;;WOS:000393448500043;;;;;;
S;"Zhang, Y; Wang, CT; Xia, XH; Sun, Y";;"Esa, R; Se, L";;"Zhang, Ying; Wang, Changtao; Xia, Xinghua; Sun, Ying";;;Path Planning of Robot Based on Improved Ant Colony Algorithm;2011 INTERNATIONAL CONFERENCE ON FUTURE INFORMATION ENGINEERING (ICFIE 2011);Lecture Notes in Information Technology;;;;International Conference on Future Information Engineering (ICFIE 2011);SEP 30-OCT 01, 2011;Bangkok, THAILAND;;;;;;;;;;;;;;;;;;;;;;2070-1918;;978-1-61275-990-6;;;;2011;8;;;;;;256;261;;;;;;;;;WOS:000393448500046;;;;;;
B;"Zhu, YF; Qin, HC; Wei, WX";;Yun, Z;;"Zhu, Yunfeng; Qin, Huanchang; Wei, Weixing";;;Consonant Passwords in the Fingers;2011 INTERNATIONAL CONFERENCE ON FUZZY SYSTEMS AND NEURAL COMPUTING (FSNC 2011), VOL I;;;;;International Conference on Fuzzy Systems and Neural Computing (FSNC 2011);FEB 20-21, 2011;Hong Kong, PEOPLES R CHINA;Hong Kong Educ Soc, Huazhong Univ Sci & Technol, IEEE Beijing Nanchang Sect IAS Chapter;;;;;;;;;;;;;;;;;;;;;;;978-1-4244-9216-9;;;;2011;;;;;;;218;222;;;;;;;;;WOS:000398329900058;;;;;;
B;"Tang, LP; Yao, MH; Chen, XG; He, TN; Wang, W";;Yun, Z;;"Tang, Liping; Yao, Minghai; Chen, Xuanguang; He, Tongneng; Wang, Wei";;;Study and Realization of a Multi-mechanism Model of Affective Computing;2011 INTERNATIONAL CONFERENCE ON FUZZY SYSTEMS AND NEURAL COMPUTING (FSNC 2011), VOL VI;;;;;International Conference on Fuzzy Systems and Neural Computing (FSNC 2011);FEB 20-21, 2011;Hong Kong, PEOPLES R CHINA;Hong Kong Educ Soc, Huazhong Univ Sci & Technol, IEEE Beijing Nanchang Sect IAS Chapter;;;;;;;;;;;;;;;;;;;;;;;978-1-4244-9216-9;;;;2011;;;;;;;103;107;;;;;;;;;WOS:000398331100028;;;;;;
B;"Gabriel, B; Stefan, O; Nicolae, P; Ioel, VS; Mircea, O; Rodica, B";;;ASME;"Gabriel, Badescu; Stefan, Ovidiu; Nicolae, Pop; Ioel, Veres Samuel; Mircea, Ortelecan; Rodica, Badescu";;;USING NEURAL NETWORKS FOR DYNAMIC VEHICLE NAVIGATION USING INTEGRATED GNSS/INS YOUR ROMANIA;2011 INTERNATIONAL CONFERENCE ON INSTRUMENTATION, MEASUREMENT, CIRCUITS AND SYSTEMS (ICIMCS 2011), VOL 2: FUTURE COMMUNICATION AND NETWORKING;;;;;International Conference on Instrumentation, Measurement, Circuits and Systems (ICIMCS 2011);DEC 12-13, 2011;Hong Kong, PEOPLES R CHINA;;;;;;;;;Stefan, Ovidiu/ABF-4700-2020;Stefan, Ovidiu/0000-0003-0775-3278;;;;;;;;;;;;;;978-0-7918-5990-2;;;;2011;;;;;;;23;+;;;;;;;;;WOS:000306295600006;;;;;;
B;"Sun, RY; Zhao, G; Liu, MT";;;ASME;"Sun Ruoying; Zhao Gang; Liu Mengting";;;A SEARCH ALGORITHM WITH GOAL RESERVE MECHANISM FOR 15-TILES PUZZLE;2011 INTERNATIONAL CONFERENCE ON INSTRUMENTATION, MEASUREMENT, CIRCUITS AND SYSTEMS (ICIMCS 2011), VOL 3: COMPUTER-AIDED DESIGN, MANUFACTURING AND MANAGEMENT;;;;;International Conference on Instrumentation, Measurement, Circuits and Systems (ICIMCS 2011);DEC 12-13, 2011;Hong Kong, PEOPLES R CHINA;;;;;;;;;;;;;;;;;;;;;;;;978-0-7918-5990-2;;;;2011;;;;;;;523;526;;;;;;;;;WOS:000306295700111;;;;;;
B;"Dong, M; Zhou, CL; Wang, LX; Li, GR; Zhao, CA";;Hu, J;;"Dong, Ming; Zhou, Chunlai; Wang, Lanxiang; Li, Guangrong; Zhao, Chengan";;;A review of Three-dimensional Reconstruction Research based on Range Image;2011 INTERNATIONAL CONFERENCE ON INTELLIGENT COMPUTATION AND INDUSTRIAL APPLICATION (ICIA2011), VOL I;;;;;International Conference on Intelligent Computation and Industrial Application (ICIA2011);JUN 18-19, 2011;Hong Kong, PEOPLES R CHINA;Int Ind Elect Ctr;;;;;;;;;;;;;;;;;;;;;;;978-988-19116-5-0;;;;2011;;;;;;;229;234;;;;;;;;;WOS:000394721800057;;;;;;
B;"Li, X; Liang, JW; Wang, XF; Lin, GD";;Hu, J;;"Li, Xia; Liang, Jianwei; Wang, Xufa; Lin, Guangdong";;;Optimized Genetic Algorithm Based on Endocrinal Regulation Mechanism;2011 INTERNATIONAL CONFERENCE ON INTELLIGENT COMPUTATION AND INDUSTRIAL APPLICATION (ICIA2011), VOL I;;;;;International Conference on Intelligent Computation and Industrial Application (ICIA2011);JUN 18-19, 2011;Hong Kong, PEOPLES R CHINA;Int Ind Elect Ctr;;;;;;;;;;;;;;;;;;;;;;;978-988-19116-5-0;;;;2011;;;;;;;353;357;;;;;;;;;WOS:000394721800087;;;;;;
B;Wang, L;;Hu, J;;Wang, Ling;;;Bio-spired Neural Computational Model for Collision Detection;2011 INTERNATIONAL CONFERENCE ON INTELLIGENT COMPUTATION AND INDUSTRIAL APPLICATION (ICIA2011), VOL I;;;;;International Conference on Intelligent Computation and Industrial Application (ICIA2011);JUN 18-19, 2011;Hong Kong, PEOPLES R CHINA;Int Ind Elect Ctr;;;;;;;;;;;;;;;;;;;;;;;978-988-19116-5-0;;;;2011;;;;;;;521;524;;;;;;;;;WOS:000394721800128;;;;;;
B;"Ma, M; Wan, RY; Guo, M; He, J";;Hu, J;;"Ma Miao; Wan Ren-yuan; Guo Min; He Jiao";;;Artificial Bee Colony Algorithm based Multifocus Image Fusion in NSCT Domain;2011 INTERNATIONAL CONFERENCE ON INTELLIGENT COMPUTATION AND INDUSTRIAL APPLICATION (ICIA2011), VOL III;;;;;International Conference on Intelligent Computation and Industrial Application (ICIA2011);JUN 18-19, 2011;Hong Kong, PEOPLES R CHINA;Int Ind Elect Ctr;;;;;;;;;;;;;;;;;;;;;;;978-988-19116-5-0;;;;2011;;;;;;;152;155;;;;;;;;;WOS:000394722000037;;;;;;
B;"Zhao, DJ; Zhang, HS; Han, YN; Yang, HT; He, Y";;Hu, J;;"Zhao Dongjie; Zhang Haisu; Han Yanni; Yang Haitao; He Yu";;;An Approach to Study Collective Intelligence Based on Networked Data Mining;2011 INTERNATIONAL CONFERENCE ON INTELLIGENT COMPUTATION AND INDUSTRIAL APPLICATION (ICIA2011), VOL IV;;;;;International Conference on Intelligent Computation and Industrial Application (ICIA2011);JUN 18-19, 2011;Hong Kong, PEOPLES R CHINA;Int Ind Elect Ctr;;;;;;;;;;;;;;;;;;;;;;;978-988-19116-5-0;;;;2011;;;;;;;238;242;;;;;;;;;WOS:000393363200058;;;;;;
B;"Zhou, YM; Krundel, L; Mulvaney, D; Chouliaras, V; Xia, X; Li, GH";;Lee, G;;"Zhou, Yimin; Krundel, Ludovic; Mulvaney, David; Chouliaras, Vassilios; Xia, Xu; Li, Guohui";;;SPIKING NEURAL NETWORKS ON SELF-UPDATING SYSTEM-ON-CHIP FOR AUTONOMOUS CONTROL;2011 INTERNATIONAL CONFERENCE ON MECHANICAL ENGINEERING AND TECHNOLOGY (ICMET 2011);;;;;International Conference on Mechanical Engineering and Technology (ICMET 2011);NOV 24-25, 2011;London, ENGLAND;;;;;;;;;;;;;;;;;;;;;;;;978-0-7918-5989-6;;;;2011;;;;;;;537;+;;;;;;;;;WOS:000320410400107;;;;;;
B;"Ma, HZ; Zhang, QJ";;Lee, G;;"Ma, Huizhu; Zhang, Qiuju";;;FUZZY CLUSTERING BASED ON CULTURE ALGORITHM FOR IMAGE SEGMENTATION;2011 INTERNATIONAL CONFERENCE ON MECHANICAL ENGINEERING AND TECHNOLOGY (ICMET 2011);;;;;International Conference on Mechanical Engineering and Technology (ICMET 2011);NOV 24-25, 2011;London, ENGLAND;;;;;;;;;;;;;;;;;;;;;;;;978-0-7918-5989-6;;;;2011;;;;;;;757;760;;;;;;;;;WOS:000320410400155;;;;;;
B;"Cao, L; Zhou, GX";;Lee, G;;"Cao, Ling; Zhou, Guangxi";;;Intangible Cultural Heritage 2.0: Research on Digitization Preservation and Promotion Strategy through Web2.0 Tools;2011 INTERNATIONAL CONFERENCE ON SOCIAL SCIENCES AND SOCIETY (ICSSS 2011), VOL 1;;;;;International Conference on Social Sciences and Society (ICSSS 2011);OCT 14-15, 2011;Shanghai, PEOPLES R CHINA;Informat Engn Res Inst, Int Commun Sci Assoc, Maldives Coll Higher Educ;;;;;;;;;;;;;;;;;;;;;;;978-0-9831693-4-5;;;;2011;;;;;;;96;+;;;;;;;;;WOS:000299796800019;;;;;;
B;Qiu, TH;;Lee, G;;Qiu Tianhe;;;Experimental Study of the Mental Process of Formulating Indirect Requests;2011 INTERNATIONAL CONFERENCE ON SOCIAL SCIENCES AND SOCIETY (ICSSS 2011), VOL 1;;;;;International Conference on Social Sciences and Society (ICSSS 2011);OCT 14-15, 2011;Shanghai, PEOPLES R CHINA;Informat Engn Res Inst, Int Commun Sci Assoc, Maldives Coll Higher Educ;;;;;;;;;;;;;;;;;;;;;;;978-0-9831693-4-5;;;;2011;;;;;;;346;349;;;;;;;;;WOS:000299796800064;;;;;;
B;Yang, YL;;Wang, Y;;Yang Yuan-li;;;Research on CTI Technology Application For Logistic Information System;2011 INTERNATIONAL CONFERENCE ON SOFTWARE ENGINEERING AND MULTIMEDIA COMMUNICATION;;;;;International Conference on Software Engineering and Multimedia Communication (SEMC 2011);JUL 09-10, 2011;Qingdao, PEOPLES R CHINA;IERI;;;;;;;;;;;;;;;;;;;;;;;978-1-61275-998-2;;;;2011;;;;;;;377;380;;;;;;;;;WOS:000391343100097;;;;;;
S;"Tsay, JJ; Chen, CC; Hsu, JJ";;;IEEE Comp Soc;"Tsay, Jyh-Jong; Chen, Chao-Cheng; Hsu, Jyh-Jung";;;Evolving Intelligent Mario Controller by Reinforcement Learning;2011 INTERNATIONAL CONFERENCE ON TECHNOLOGIES AND APPLICATIONS OF ARTIFICIAL INTELLIGENCE (TAAI 2011);Conference on Technologies and Applications of Artificial Intelligence;;;;16th Annual International Conference on Technologies and Applications of Artificial Intelligence (TAAI);NOV 11-13, 2011;Chung Li, TAIWAN;IEEE Comp Soc, Taiwanese Assoc AI, Japanese Soc Artificial Intelligence, Yuan Ze Univ, Natl Cent Univ;;;;;;;;;;;;;;;;;;;;;2376-6816;;978-0-7695-4601-8;;;;2011;;;;;;;266;272;;10.1109/TAAI.2011.54;;;;;;;WOS:000399726900045;;;;;;
B;Roy, A;;;IEEE;Roy, Asim;;;A theory of the brain - the brain uses both distributed and localist (symbolic) representation;2011 INTERNATIONAL JOINT CONFERENCE ON NEURAL NETWORKS (IJCNN);;;;;International Joint Conference on Neural Networks (IJCNN);JUL 31-AUG 05, 2011;San Jose, CA;Int Neural Network Soc (INNS), IEEE Computat Intelligence Soc (CIS), Natl Sci Fdn (NSF), Cognimem Technol, Inc, Univ Cincinnati Coll Engn & Appl Sci, Toyota Res Inst N Amer, Univ Cincinnati, Sch Elect & Compu Syst;;;;;;;;;;;;;;;;;;;;;;;978-1-4244-9636-5;;;;2011;;;;;;;215;221;;;;;;;;;WOS:000297541200034;;;;;;
B;"Nawrocki, RA; Shaheen, SE; Voyles, RM";;;IEEE;"Nawrocki, Robert A.; Shaheen, Sean E.; Voyles, Richard M.";;;A Neuromorphic Architecture From Single Transistor Neurons With Organic Bistable Devices For Weights;2011 INTERNATIONAL JOINT CONFERENCE ON NEURAL NETWORKS (IJCNN);;;;;International Joint Conference on Neural Networks (IJCNN);JUL 31-AUG 05, 2011;San Jose, CA;Int Neural Network Soc (INNS), IEEE Computat Intelligence Soc (CIS), Natl Sci Fdn (NSF), Cognimem Technol, Inc, Univ Cincinnati Coll Engn & Appl Sci, Toyota Res Inst N Amer, Univ Cincinnati, Sch Elect & Compu Syst;;;;;;;;"Nawrocki, Robert/I-9928-2014; Voyles, Richard/I-4258-2016; Nawrocki, Robert/AAU-9047-2020; Shaheen, Sean E/M-7893-2013";"Nawrocki, Robert/0000-0003-0695-3868; Nawrocki, Robert/0000-0003-0695-3868; ";;;;;;;;;;;;;;978-1-4244-9636-5;;;;2011;;;;;;;450;456;;;;;;;;;WOS:000297541200066;;;;;;
B;"Cupertino, LF; Neto, OPV; Pacheco, MAC; Vellasco, MBR; d'Almeida, JRM";;;IEEE;"Cupertino, Leandro F.; Vilela Neto, Omar P.; Pacheco, Marco Aurelio C.; Vellasco, Marley B. R.; d'Almeida, Jose Roberto M.";;;Modeling the Young Modulus of Nanocomposites: A Neural Network Approach;2011 INTERNATIONAL JOINT CONFERENCE ON NEURAL NETWORKS (IJCNN);;;;;International Joint Conference on Neural Networks (IJCNN);JUL 31-AUG 05, 2011;San Jose, CA;Int Neural Network Soc (INNS), IEEE Computat Intelligence Soc (CIS), Natl Sci Fdn (NSF), Cognimem Technol, Inc, Univ Cincinnati Coll Engn & Appl Sci, Toyota Res Inst N Amer, Univ Cincinnati, Sch Elect & Compu Syst;;;;;;;;"d'Almeida, Jose/F-3231-2012; Neto, Omar Vilela/AAB-5319-2020; Vellasco, Marley M B R/A-5126-2010; Neto, Omar Paranaiba Vilela/AAB-5312-2020; Pacheco, Marco Aurelio/Q-3592-2016";"Neto, Omar Vilela/0000-0003-1769-0629; Vellasco, Marley M B R/0000-0002-9790-1328; ";;;;;;;;;;;;;;978-1-4244-9636-5;;;;2011;;;;;;;1599;1605;;;;;;;;;WOS:000297541201102;;;;;;
B;"Shantia, A; Begue, E; Wiering, M";;;IEEE;"Shantia, Amirhosein; Begue, Eric; Wiering, Marco";;;Connectionist Reinforcement Learning for Intelligent Unit Micro Management in StarCraft;2011 INTERNATIONAL JOINT CONFERENCE ON NEURAL NETWORKS (IJCNN);;;;;International Joint Conference on Neural Networks (IJCNN);JUL 31-AUG 05, 2011;San Jose, CA;Int Neural Network Soc (INNS), IEEE Computat Intelligence Soc (CIS), Natl Sci Fdn (NSF), Cognimem Technol, Inc, Univ Cincinnati Coll Engn & Appl Sci, Toyota Res Inst N Amer, Univ Cincinnati, Sch Elect & Compu Syst;;;;;;;;Wiering, Marco/C-5909-2012;Wiering, Marco/0000-0003-4331-7537;;;;;;;;;;;;;;978-1-4244-9636-5;;;;2011;;;;;;;1794;1801;;;;;;;;;WOS:000297541201129;;;;;;
B;"Conforth, M; Meng, Y";;;IEEE;"Conforth, Matthew; Meng, Yan";;;Self-Reorganizing Knowledge Representation for Autonomous Learning in Social Agents;2011 INTERNATIONAL JOINT CONFERENCE ON NEURAL NETWORKS (IJCNN);;;;;International Joint Conference on Neural Networks (IJCNN);JUL 31-AUG 05, 2011;San Jose, CA;Int Neural Network Soc (INNS), IEEE Computat Intelligence Soc (CIS), Natl Sci Fdn (NSF), Cognimem Technol, Inc, Univ Cincinnati Coll Engn & Appl Sci, Toyota Res Inst N Amer, Univ Cincinnati, Sch Elect & Compu Syst;;;;;;;;;;;;;;;;;;;;;;;978-1-4244-9636-5;;;;2011;;;;;;;1880;1887;;;;;;;;;WOS:000297541202002;;;;;;
B;"Bahi, JM; Cote, N; Guyeux, C";;;IEEE;"Bahi, Jacques M.; Cote, Nathalie; Guyeux, Christophe";;;Chaos of Protein Folding;2011 INTERNATIONAL JOINT CONFERENCE ON NEURAL NETWORKS (IJCNN);;;;;International Joint Conference on Neural Networks (IJCNN);JUL 31-AUG 05, 2011;San Jose, CA;Int Neural Network Soc (INNS), IEEE Computat Intelligence Soc (CIS), Natl Sci Fdn (NSF), Cognimem Technol, Inc, Univ Cincinnati Coll Engn & Appl Sci, Toyota Res Inst N Amer, Univ Cincinnati, Sch Elect & Compu Syst;;;;;;;;Guyeux, Christophe/C-2153-2011;Guyeux, Christophe/0000-0003-0195-4378;;;;;;;;;;;;;;978-1-4244-9636-5;;;;2011;;;;;;;1948;1954;;;;;;;;;WOS:000297541202012;;;;;;
B;Weng, JY;;;IEEE;Weng, Juyang;;;Three Theorems: Brain-Like Networks Logically Reason and Optimally Generalize;2011 INTERNATIONAL JOINT CONFERENCE ON NEURAL NETWORKS (IJCNN);;;;;International Joint Conference on Neural Networks (IJCNN);JUL 31-AUG 05, 2011;San Jose, CA;Int Neural Network Soc (INNS), IEEE Computat Intelligence Soc (CIS), Natl Sci Fdn (NSF), Cognimem Technol, Inc, Univ Cincinnati Coll Engn & Appl Sci, Toyota Res Inst N Amer, Univ Cincinnati, Sch Elect & Compu Syst;;;;;;;;;;;;;;;;;;;;;;;978-1-4244-9636-5;;;;2011;;;;;;;2983;2990;;;;;;;;;WOS:000297541203017;;;;;;
B;"Tienkouw, S; Wongtosrad, N; Tanwanont, P; Niraswan, R; Khlayprapha, C; Taesuwan, P; Muangthong, T; Chanyachatchawan, S; Tuchinda, R; Charoenporn, T; Sornlertlamvanich, V";;"Kocaoglu, DF; Anderson, TR; Daim, TU";;"Tienkouw, Sineenat; Wongtosrad, Nutvadee; Tanwanont, Paramet; Niraswan, Rattapoom; Khlayprapha, Chaimongkon; Taesuwan, Pisan; Muangthong, Thanate; Chanyachatchawan, Sapa; Tuchinda, Rattapoom; Charoenporn, Thatsanee; Sornlertlamvanich, Virach";;;Technology-Based Strategic Marketing Planning for Pi-Pe;2011 PROCEEDINGS OF PICMET 11: TECHNOLOGY MANAGEMENT IN THE ENERGY-SMART WORLD (PICMET);;;;;Portland International Center for Management of Engineering and Technology (PICMET) Conference on Technology Management in the Energy-Smart World;JUL 31-AUG 04, 2011;Portland, OR;Portland State Univ, Maseeh Coll Engn & Comp Sci, Dept Engn & Technol Management, Portland State Univ, Off Informat Technol, IKON Off Solut;;;;;;;;Sornlertlamvanich, Virach/N-2616-2017;Sornlertlamvanich, Virach/0000-0002-6918-8713;;;;;;;;;;;;;;978-1-890843-23-6;;;;2011;;;;;;;;;;;;;;;;;WOS:000298384400095;;;;;;
B;"Ren, SP; Yang, GY";;Zhou, M;;"Ren Shupeng; Yang Guangying";;;The innovative design of the robot picking fruits;2011 SECOND ETP/IITA CONFERENCE ON TELECOMMUNICATION AND INFORMATION (TEIN 2011), VOL 1;;;;;2nd ETP/IITA Conference on Telecommunication and Information;APR 03-04, 2011;Phuket, THAILAND;Engn Technol Press, Thammasat Univ;;;;;;;;;;;;;;;;;;;;;;;978-988-18242-0-2;;;;2011;;;;;;;203;206;;;;;;;;;WOS:000290971800058;;;;;;
B;Shan, XM;;Zhou, M;;Shan, Xianming;;;Design and Implementation of Maintenance Information Support System of Artillery Radar;2011 SECOND ETP/IITA CONFERENCE ON TELECOMMUNICATION AND INFORMATION (TEIN 2011), VOL 2;;;;;2nd ETP/IITA Conference on Telecommunication and Information;APR 03-04, 2011;Phuket, THAILAND;Engn Technol Press, Thammasat Univ;;;;;;;;;;;;;;;;;;;;;;;978-988-18242-0-2;;;;2011;;;;;;;37;40;;;;;;;;;WOS:000290974800010;;;;;;
B;"Carlos, RE; Francklin, RE; Lizmar, M; Solange, G; Veronica, R";;Lee, G;;"Carlos, Rivas-Echeverria; Francklin, Rivas-Echeverria; Lizmar, Molina; Solange, Gonzalez; Veronica, Rivas";;;A Summary, Insight and Autocriticism of Information Systems That We Have Developed for Medical Education;2011 SECOND INTERNATIONAL CONFERENCE ON INFORMATION, COMMUNICATION AND EDUCATION APPLICATION (ICEA 2011);;;;;2nd International Conference on Information, Communication and Education Application (ICEA 2011);OCT 14-15, 2011;Shanghai, PEOPLES R CHINA;;;;;;;;;;;;;;;;;;;;;;;;978-1-61275-997-5;;;;2011;;;;;;;133;138;;;;;;;;;WOS:000303430600026;;;;;;
B;"Yefu, W; Li, B; Chaozhong, W; Shigang, P; Shen, H";;;IEEE;"Yefu Wu; Li Bo; Chaozhong Wu; Shigang Pan; Shen Hui";;;Real-time Automatic Evaluation Technology in Vehicle Road Test System Based on Neural Network;2011 TENTH INTERNATIONAL SYMPOSIUM ON DISTRIBUTED COMPUTING AND APPLICATIONS TO BUSINESS, ENGINEERING AND SCIENCE (DCABES);;;;;10th International Symposium on Distributed Computing and Applications to Business, Engineering and Science (DCABES);OCT 14-17, 2011;Jiangnan Univ, Wuxi, PEOPLES R CHINA;IEEE Comp Soc;Jiangnan Univ;;;;;;;;;;;;;;;;;;;;;;978-0-7695-4415-1;;;;2011;;;;;;;386;390;;10.1109/DCABES.2011.73;;;;;;;WOS:000312651300086;;;;;;
B;"Aarthi, R; Divya, K; Komala, N; Kavitha, S";;;IEEE;"Aarthi, R.; Divya, K.; Komala, N.; Kavitha, S.";;;Application of Feature Extraction and Clustering in Mammogram Classification using Support Vector Machine;2011 THIRD INTERNATIONAL CONFERENCE ON ADVANCED COMPUTING (ICOAC);;;;;3rd International Conference on Advanced Computing (ICoAC);DEC 14-16, 2011;Anna Univ, Dept Comp Technol, Chennai, INDIA;IEEE, IEEE Madras Sect, Cognizant Technol Solutions, Rajalakshmi Engn Coll, Sri Venkateswara Coll Engn, Vel Tech Dr RR & Dr SR Tech Univ;Anna Univ, Dept Comp Technol;;;;;;;;;;;;;;;;;;;;;;"978-1-4673-0670-6; 978-1-4673-0669-0";;;;2011;;;;;;;62;67;;;;;;;;;WOS:000313751300034;;;;;;
